{
    "componentChunkName": "component---node-modules-gatsby-theme-primer-wiki-src-templates-latest-query-js",
    "path": "/latest/",
    "result": {"data":{"site":{"pathPrefix":"","siteMetadata":{"siteUrl":"https://devdocs.webizen.org"}},"allMdx":{"nodes":[{"frontmatter":{"title":"","draft":false},"fields":{"slug":"/WebizenTechStack/Webizen2.5/DevNotesWebizen2.5/ImplementationNotes-2.5/","title":"ImplementationNotes-2.5","lastUpdated":"1/29/2023","lastUpdatedAt":"2023-01-29T01:31:56.000Z","gitCreatedAt":"2023-01-29T01:31:56.000Z"}},{"frontmatter":{"title":"","draft":false},"fields":{"slug":"/WebizenTechStack/Webizen3.5/AICapabilities/Audio & Video Analysis/","title":"Audio & Video Analysis","lastUpdated":"1/9/2023","lastUpdatedAt":"2023-01-09T04:33:42.000Z","gitCreatedAt":"2023-01-09T04:33:42.000Z"}},{"frontmatter":{"title":"","draft":false},"fields":{"slug":"/WebizenTechStack/Webizen3.5/AICapabilities/Image Analysis/","title":"Image Analysis","lastUpdated":"1/9/2023","lastUpdatedAt":"2023-01-09T04:33:42.000Z","gitCreatedAt":"2023-01-09T04:33:42.000Z"}},{"frontmatter":{"title":"","draft":false},"fields":{"slug":"/WebizenTechStack/Webizen3.5/AICapabilities/Text Analysis/","title":"Text Analysis","lastUpdated":"1/9/2023","lastUpdatedAt":"2023-01-09T04:33:42.000Z","gitCreatedAt":"2023-01-09T04:33:42.000Z"}},{"frontmatter":{"title":"","draft":false},"fields":{"slug":"/WebizenTechStack/WebizenApps/Webizen3.5Apps/MobileApps/Android/","title":"Android","lastUpdated":"1/9/2023","lastUpdatedAt":"2023-01-09T04:33:42.000Z","gitCreatedAt":"2023-01-09T04:33:42.000Z"}},{"frontmatter":{"title":"","draft":false},"fields":{"slug":"/WebizenTechStack/WebizenApps/Webizen3.5Apps/MobileApps/iOS/","title":"iOS","lastUpdated":"1/9/2023","lastUpdatedAt":"2023-01-09T04:33:42.000Z","gitCreatedAt":"2023-01-09T04:33:42.000Z"}},{"frontmatter":{"title":"","draft":false},"fields":{"slug":"/WebizenTechStack/Webizen2.5/DevNotesWebizen2.5/ImplementationNotes-2.5/Webizen2.5HostComponents/BasicWebizenNetworking2.5/TailNets/","title":"TailNets","lastUpdated":"1/29/2023","lastUpdatedAt":"2023-01-29T01:31:56.000Z","gitCreatedAt":"2023-01-29T01:31:56.000Z"}},{"frontmatter":{"title":"","draft":false},"fields":{"slug":"/Agent-Labelling-WIP/","title":"Agent-Labelling-WIP","lastUpdated":"1/19/2023","lastUpdatedAt":"2023-01-19T15:25:57.000Z","gitCreatedAt":"2023-01-19T10:09:31.000Z"}},{"frontmatter":{"title":"","draft":false},"fields":{"slug":"/DocumentationMethod/","title":"Documentation Method","lastUpdated":"1/9/2023","lastUpdatedAt":"2023-01-09T04:33:42.000Z","gitCreatedAt":"2023-01-09T01:08:05.000Z"}},{"frontmatter":{"title":"","draft":false},"fields":{"slug":"/GuideForDevelopers/","title":"DRAFT: Guide For Developers","lastUpdated":"2/4/2023","lastUpdatedAt":"2023-02-04T16:41:41.000Z","gitCreatedAt":"2023-01-30T22:53:41.000Z"}},{"frontmatter":{"title":"","draft":false},"fields":{"slug":"/PermissiveCommons/","title":"Permissive Commons","lastUpdated":"1/30/2023","lastUpdatedAt":"2023-01-30T22:53:41.000Z","gitCreatedAt":"2023-01-19T10:09:31.000Z"}},{"frontmatter":{"title":"","draft":false},"fields":{"slug":"/","title":"Webizen Docs Introduction","lastUpdated":"2/3/2023","lastUpdatedAt":"2023-02-03T11:21:01.000Z","gitCreatedAt":"2022-12-28T13:53:25.000Z"}},{"frontmatter":{"title":"","draft":false},"fields":{"slug":"/SocialFactors/","title":"Social Factors","lastUpdated":"1/9/2023","lastUpdatedAt":"2023-01-09T04:33:42.000Z","gitCreatedAt":"2023-01-09T04:33:42.000Z"}},{"frontmatter":{"title":"","draft":false},"fields":{"slug":"/WebizenTechStack/","title":"Webizen Tech Stack","lastUpdated":"1/24/2023","lastUpdatedAt":"2023-01-24T14:14:45.000Z","gitCreatedAt":"2023-01-09T04:33:42.000Z"}},{"frontmatter":{"title":"","draft":false},"fields":{"slug":"/WorkInProgress/","title":"Work in Progress","lastUpdated":"1/30/2023","lastUpdatedAt":"2023-01-30T22:53:41.000Z","gitCreatedAt":"2023-01-09T01:08:05.000Z"}},{"frontmatter":{"title":"","draft":false},"fields":{"slug":"/old-work-archives/","title":"Old-Work-Archives","lastUpdated":"1/9/2023","lastUpdatedAt":"2023-01-09T01:08:05.000Z","gitCreatedAt":"2022-12-30T17:23:12.000Z"}},{"frontmatter":{"title":"","draft":false},"fields":{"slug":"/GuideForDevelopers/DevPractices/","title":"Dev Practices Guide","lastUpdated":"2/5/2023","lastUpdatedAt":"2023-02-05T06:25:02.000Z","gitCreatedAt":"2023-02-05T05:32:02.000Z"}},{"frontmatter":{"title":"","draft":false},"fields":{"slug":"/GuideForDevelopers/WebizenDiscord/","title":"Webizen on Discord","lastUpdated":"2/3/2023","lastUpdatedAt":"2023-02-03T11:21:01.000Z","gitCreatedAt":"2023-02-03T09:07:14.000Z"}},{"frontmatter":{"title":"","draft":false},"fields":{"slug":"/GuideForDevelopers/WebizenTerms/","title":"Webizen Terms","lastUpdated":"2/5/2023","lastUpdatedAt":"2023-02-05T05:32:02.000Z","gitCreatedAt":"2023-02-03T09:07:14.000Z"}},{"frontmatter":{"title":"","draft":false},"fields":{"slug":"/PermissiveCommons/PCTOntologyModelling/","title":"PCT Ontology Modelling","lastUpdated":"1/24/2023","lastUpdatedAt":"2023-01-24T14:14:45.000Z","gitCreatedAt":"2023-01-19T15:25:57.000Z"}},{"frontmatter":{"title":"","draft":false},"fields":{"slug":"/PermissiveCommons/PermissiveCommonsTech/","title":"Permissive Commons Tech","lastUpdated":"1/19/2023","lastUpdatedAt":"2023-01-19T10:09:31.000Z","gitCreatedAt":"2023-01-19T10:09:31.000Z"}},{"frontmatter":{"title":"","draft":false},"fields":{"slug":"/PermissiveCommons/SDGs/","title":"Sustainable Development Goals (ESG)","lastUpdated":"1/19/2023","lastUpdatedAt":"2023-01-19T10:09:31.000Z","gitCreatedAt":"2023-01-19T10:09:31.000Z"}},{"frontmatter":{"title":"","draft":false},"fields":{"slug":"/SocialFactors/Background/","title":"Background","lastUpdated":"1/9/2023","lastUpdatedAt":"2023-01-09T04:33:42.000Z","gitCreatedAt":"2023-01-09T04:33:42.000Z"}},{"frontmatter":{"title":"","draft":false},"fields":{"slug":"/SocialFactors/CommercialModels/","title":"Commercial Models","lastUpdated":"1/24/2023","lastUpdatedAt":"2023-01-24T14:14:45.000Z","gitCreatedAt":"2023-01-09T04:33:42.000Z"}},{"frontmatter":{"title":"","draft":false},"fields":{"slug":"/SocialFactors/PeaceInfrastructureProject/","title":"Peace Infrastructure Project","lastUpdated":"1/30/2023","lastUpdatedAt":"2023-01-30T22:53:41.000Z","gitCreatedAt":"2023-01-09T04:33:42.000Z"}},{"frontmatter":{"title":"","draft":false},"fields":{"slug":"/SocialFactors/SocialAttackVectors/","title":"Social Attack Vectors","lastUpdated":"1/24/2023","lastUpdatedAt":"2023-01-24T14:14:45.000Z","gitCreatedAt":"2023-01-09T04:33:42.000Z"}},{"frontmatter":{"title":"","draft":false},"fields":{"slug":"/SocialFactors/SocioEconomicTechReqs/","title":"Commercial-Technical Requirements","lastUpdated":"1/9/2023","lastUpdatedAt":"2023-01-09T04:33:42.000Z","gitCreatedAt":"2023-01-09T04:33:42.000Z"}},{"frontmatter":{"title":"","draft":false},"fields":{"slug":"/SocialFactors/WebScience/","title":"Web Science","lastUpdated":"1/12/2023","lastUpdatedAt":"2023-01-12T03:09:19.000Z","gitCreatedAt":"2023-01-09T04:33:42.000Z"}},{"frontmatter":{"title":"","draft":false},"fields":{"slug":"/SocialFactors/Webizen3.0SetupUserExperience/","title":"Webizen 3.0 Setup User Experience","lastUpdated":"1/9/2023","lastUpdatedAt":"2023-01-09T04:33:42.000Z","gitCreatedAt":"2023-01-09T04:33:42.000Z"}},{"frontmatter":{"title":"","draft":false},"fields":{"slug":"/SocialFactors/WebizenForHumans/","title":"Webizen: For Humans","lastUpdated":"1/9/2023","lastUpdatedAt":"2023-01-09T04:33:42.000Z","gitCreatedAt":"2023-01-09T04:33:42.000Z"}},{"frontmatter":{"title":"","draft":false},"fields":{"slug":"/WebizenTechStack/AuthenticationFabric/","title":"Authentication Fabric","lastUpdated":"1/9/2023","lastUpdatedAt":"2023-01-09T04:33:42.000Z","gitCreatedAt":"2023-01-09T04:33:42.000Z"}},{"frontmatter":{"title":"","draft":false},"fields":{"slug":"/WebizenTechStack/CoreServices/","title":"Core Services","lastUpdated":"1/18/2023","lastUpdatedAt":"2023-01-18T16:25:14.000Z","gitCreatedAt":"2023-01-09T04:33:42.000Z"}},{"frontmatter":{"title":"","draft":false},"fields":{"slug":"/WebizenTechStack/CoreTechnologies/","title":"Core Technologies","lastUpdated":"1/9/2023","lastUpdatedAt":"2023-01-09T04:33:42.000Z","gitCreatedAt":"2023-01-09T04:33:42.000Z"}},{"frontmatter":{"title":"","draft":false},"fields":{"slug":"/WebizenTechStack/DataStoreVaultNotes/","title":"Private DataStore (Vault)","lastUpdated":"1/20/2023","lastUpdatedAt":"2023-01-20T22:14:02.000Z","gitCreatedAt":"2023-01-20T22:14:02.000Z"}},{"frontmatter":{"title":"","draft":false},"fields":{"slug":"/WebizenTechStack/EngineeringConsiderations/","title":"Engineering Considerations","lastUpdated":"1/24/2023","lastUpdatedAt":"2023-01-24T14:14:45.000Z","gitCreatedAt":"2023-01-09T04:33:42.000Z"}},{"frontmatter":{"title":"","draft":false},"fields":{"slug":"/WebizenTechStack/VocabularyModelling/","title":"Vocabulary Modelling","lastUpdated":"1/20/2023","lastUpdatedAt":"2023-01-20T22:14:02.000Z","gitCreatedAt":"2023-01-20T22:14:02.000Z"}},{"frontmatter":{"title":"","draft":false},"fields":{"slug":"/WebizenTechStack/Webize/","title":"Webize","lastUpdated":"1/30/2023","lastUpdatedAt":"2023-01-30T22:53:41.000Z","gitCreatedAt":"2023-01-30T22:53:41.000Z"}},{"frontmatter":{"title":"","draft":false},"fields":{"slug":"/WebizenTechStack/Webizen2.5/","title":"Webizen 2.5 Dev","lastUpdated":"1/29/2023","lastUpdatedAt":"2023-01-29T01:31:56.000Z","gitCreatedAt":"2023-01-29T01:31:56.000Z"}},{"frontmatter":{"title":"","draft":false},"fields":{"slug":"/WebizenTechStack/Webizen3.0/","title":"Webizen 3.0","lastUpdated":"1/24/2023","lastUpdatedAt":"2023-01-24T14:14:45.000Z","gitCreatedAt":"2023-01-09T04:33:42.000Z"}},{"frontmatter":{"title":"","draft":false},"fields":{"slug":"/WebizenTechStack/Webizen3.5/","title":"Webizen 3.5","lastUpdated":"1/9/2023","lastUpdatedAt":"2023-01-09T04:33:42.000Z","gitCreatedAt":"2023-01-09T04:33:42.000Z"}},{"frontmatter":{"title":"","draft":false},"fields":{"slug":"/WebizenTechStack/Webizen4.0/","title":"Webizen 4.0","lastUpdated":"1/9/2023","lastUpdatedAt":"2023-01-09T04:33:42.000Z","gitCreatedAt":"2023-01-09T04:33:42.000Z"}},{"frontmatter":{"title":"","draft":false},"fields":{"slug":"/WebizenTechStack/WebizenApps/","title":"Webizen Apps","lastUpdated":"1/9/2023","lastUpdatedAt":"2023-01-09T04:33:42.000Z","gitCreatedAt":"2023-01-09T04:33:42.000Z"}},{"frontmatter":{"title":"","draft":false},"fields":{"slug":"/old-work-archives/2005LotsOfIdeas-SomeBig&SomeSmall/","title":"2005 Lots of ideas - some big & some small","lastUpdated":"1/18/2023","lastUpdatedAt":"2023-01-18T10:51:50.000Z","gitCreatedAt":"2023-01-18T10:51:50.000Z"}},{"frontmatter":{"title":"","draft":false},"fields":{"slug":"/old-work-archives/2018-webizen-net-au/","title":"2018-Webizen-Net-Au","lastUpdated":"12/30/2022","lastUpdatedAt":"2022-12-30T19:08:33.000Z","gitCreatedAt":"2022-12-30T19:08:33.000Z"}},{"frontmatter":{"title":"","draft":false},"fields":{"slug":"/old-work-archives/Basedrive/","title":"Basedrive","lastUpdated":"1/24/2023","lastUpdatedAt":"2023-01-24T13:18:40.000Z","gitCreatedAt":"2023-01-24T13:18:40.000Z"}},{"frontmatter":{"title":"","draft":false},"fields":{"slug":"/old-work-archives/Human-Centric/","title":"Human Centric","lastUpdated":"2/4/2023","lastUpdatedAt":"2023-02-04T16:41:41.000Z","gitCreatedAt":"2023-02-04T16:41:41.000Z"}},{"frontmatter":{"title":"","draft":false},"fields":{"slug":"/old-work-archives/LinkedInArticles/","title":"LinkedIn Articles","lastUpdated":"1/18/2023","lastUpdatedAt":"2023-01-18T10:51:50.000Z","gitCreatedAt":"2023-01-18T10:51:50.000Z"}},{"frontmatter":{"title":"","draft":false},"fields":{"slug":"/old-work-archives/WebCivicsMediumPosts/","title":"WebCivics Medium Posts","lastUpdated":"1/18/2023","lastUpdatedAt":"2023-01-18T10:51:50.000Z","gitCreatedAt":"2023-01-18T10:51:50.000Z"}},{"frontmatter":{"title":"","draft":false},"fields":{"slug":"/old-work-archives/WebizenGroup2015/","title":"Webizen Group 2015","lastUpdated":"1/18/2023","lastUpdatedAt":"2023-01-18T10:51:50.000Z","gitCreatedAt":"2023-01-18T10:51:50.000Z"}},{"frontmatter":{"title":"","draft":false},"fields":{"slug":"/old-work-archives/iBank/","title":"iBANK - Concept overview","lastUpdated":"1/24/2023","lastUpdatedAt":"2023-01-24T13:18:40.000Z","gitCreatedAt":"2023-01-24T13:18:40.000Z"}},{"frontmatter":{"title":"","draft":false},"fields":{"slug":"/PermissiveCommons/PCTOntologyModelling/BiosphereOntologies/","title":"Biosphere Ontologies","lastUpdated":"1/24/2023","lastUpdatedAt":"2023-01-24T14:14:45.000Z","gitCreatedAt":"2023-01-19T15:25:57.000Z"}},{"frontmatter":{"title":"","draft":false},"fields":{"slug":"/PermissiveCommons/PCTOntologyModelling/EnglishLanguageModelling/","title":"English Language Modelling","lastUpdated":"1/19/2023","lastUpdatedAt":"2023-01-19T15:25:57.000Z","gitCreatedAt":"2023-01-19T15:25:57.000Z"}},{"frontmatter":{"title":"","draft":false},"fields":{"slug":"/PermissiveCommons/PCTOntologyModelling/NLP/","title":"NLP","lastUpdated":"1/19/2023","lastUpdatedAt":"2023-01-19T15:25:57.000Z","gitCreatedAt":"2023-01-19T15:25:57.000Z"}},{"frontmatter":{"title":"","draft":false},"fields":{"slug":"/PermissiveCommons/PCTOntologyModelling/OntologyModelling/","title":"Ontology Modelling","lastUpdated":"1/19/2023","lastUpdatedAt":"2023-01-19T15:25:57.000Z","gitCreatedAt":"2023-01-19T15:25:57.000Z"}},{"frontmatter":{"title":"","draft":false},"fields":{"slug":"/PermissiveCommons/PCTOntologyModelling/PCTWebizenUseOfOntology/","title":"PCTWebizenUseOfOntology","lastUpdated":"1/20/2023","lastUpdatedAt":"2023-01-20T22:14:02.000Z","gitCreatedAt":"2023-01-19T15:25:57.000Z"}},{"frontmatter":{"title":"","draft":false},"fields":{"slug":"/PermissiveCommons/PCTOntologyModelling/SocioSphereOntologies/","title":"SocioSphere Ontologies","lastUpdated":"1/19/2023","lastUpdatedAt":"2023-01-19T15:25:57.000Z","gitCreatedAt":"2023-01-19T15:25:57.000Z"}},{"frontmatter":{"title":"","draft":false},"fields":{"slug":"/PermissiveCommons/PCTOntologyModelling/UnderstandingOntologies/","title":"Understanding Ontologies","lastUpdated":"1/19/2023","lastUpdatedAt":"2023-01-19T15:25:57.000Z","gitCreatedAt":"2023-01-19T15:25:57.000Z"}},{"frontmatter":{"title":"","draft":false},"fields":{"slug":"/PermissiveCommons/PermissiveCommonsTech/PCTProblemStatement/","title":"Problem Statement","lastUpdated":"1/30/2023","lastUpdatedAt":"2023-01-30T22:53:41.000Z","gitCreatedAt":"2023-01-19T10:09:31.000Z"}},{"frontmatter":{"title":"","draft":false},"fields":{"slug":"/PermissiveCommons/PermissiveCommonsTech/PCTRequirements/","title":"PCTRequirements","lastUpdated":"1/19/2023","lastUpdatedAt":"2023-01-19T10:09:31.000Z","gitCreatedAt":"2023-01-19T10:09:31.000Z"}},{"frontmatter":{"title":"","draft":false},"fields":{"slug":"/PermissiveCommons/PermissiveCommonsTech/PCTWorkInProgress/","title":"Work in Progress","lastUpdated":"1/30/2023","lastUpdatedAt":"2023-01-30T22:53:41.000Z","gitCreatedAt":"2023-01-19T10:09:31.000Z"}},{"frontmatter":{"title":"","draft":false},"fields":{"slug":"/PermissiveCommons/PermissiveCommonsTech/WhatAreTheCommons/","title":"What are 'The Commons'","lastUpdated":"1/30/2023","lastUpdatedAt":"2023-01-30T22:53:41.000Z","gitCreatedAt":"2023-01-19T10:09:31.000Z"}},{"frontmatter":{"title":"","draft":false},"fields":{"slug":"/PermissiveCommons/PermissiveCommonsTech/WhatIsOpenData/","title":"What is 'Open Data'","lastUpdated":"1/19/2023","lastUpdatedAt":"2023-01-19T10:09:31.000Z","gitCreatedAt":"2023-01-19T10:09:31.000Z"}},{"frontmatter":{"title":"","draft":false},"fields":{"slug":"/SocialFactors/CommercialModels/BestEfforts/","title":"Best Efforts","lastUpdated":"1/9/2023","lastUpdatedAt":"2023-01-09T04:33:42.000Z","gitCreatedAt":"2023-01-09T04:33:42.000Z"}},{"frontmatter":{"title":"","draft":false},"fields":{"slug":"/SocialFactors/CommercialModels/Currencies/","title":"Currencies","lastUpdated":"1/9/2023","lastUpdatedAt":"2023-01-09T04:33:42.000Z","gitCreatedAt":"2023-01-09T04:33:42.000Z"}},{"frontmatter":{"title":"","draft":false},"fields":{"slug":"/SocialFactors/CommercialModels/ESG/","title":"Environmental, Social and Governance (ESG)","lastUpdated":"1/24/2023","lastUpdatedAt":"2023-01-24T14:14:45.000Z","gitCreatedAt":"2023-01-09T04:33:42.000Z"}},{"frontmatter":{"title":"","draft":false},"fields":{"slug":"/SocialFactors/CommercialModels/EconomicSystems/","title":"Economic Systems","lastUpdated":"1/24/2023","lastUpdatedAt":"2023-01-24T14:14:45.000Z","gitCreatedAt":"2023-01-09T04:33:42.000Z"}},{"frontmatter":{"title":"","draft":false},"fields":{"slug":"/SocialFactors/CommercialModels/FitForPurpose/","title":"Fit For Purpose","lastUpdated":"1/9/2023","lastUpdatedAt":"2023-01-09T04:33:42.000Z","gitCreatedAt":"2023-01-09T04:33:42.000Z"}},{"frontmatter":{"title":"","draft":false},"fields":{"slug":"/SocialFactors/CommercialModels/HardwareStrategy/","title":"Hardware Strategy","lastUpdated":"1/18/2023","lastUpdatedAt":"2023-01-18T10:51:50.000Z","gitCreatedAt":"2023-01-09T04:33:42.000Z"}},{"frontmatter":{"title":"","draft":false},"fields":{"slug":"/SocialFactors/CommercialModels/Historical Information/","title":"Historical Information","lastUpdated":"1/9/2023","lastUpdatedAt":"2023-01-09T04:33:42.000Z","gitCreatedAt":"2023-01-09T04:33:42.000Z"}},{"frontmatter":{"title":"","draft":false},"fields":{"slug":"/SocialFactors/CommercialModels/TrustFactory/","title":"Trust Factory","lastUpdated":"1/9/2023","lastUpdatedAt":"2023-01-09T04:33:42.000Z","gitCreatedAt":"2023-01-09T04:33:42.000Z"}},{"frontmatter":{"title":"","draft":false},"fields":{"slug":"/SocialFactors/CommercialModels/Webizen/","title":"Webizen","lastUpdated":"1/12/2023","lastUpdatedAt":"2023-01-12T03:09:19.000Z","gitCreatedAt":"2023-01-09T04:33:42.000Z"}},{"frontmatter":{"title":"","draft":false},"fields":{"slug":"/SocialFactors/CommercialModels/WebizenAlliance/","title":"Webizen Alliance","lastUpdated":"1/24/2023","lastUpdatedAt":"2023-01-24T14:14:45.000Z","gitCreatedAt":"2023-01-09T04:33:42.000Z"}},{"frontmatter":{"title":"","draft":false},"fields":{"slug":"/SocialFactors/CommercialModels/WebizenProUsecases/","title":"WebizenPro Usecases","lastUpdated":"1/9/2023","lastUpdatedAt":"2023-01-09T04:33:42.000Z","gitCreatedAt":"2023-01-09T04:33:42.000Z"}},{"frontmatter":{"title":"","draft":false},"fields":{"slug":"/SocialFactors/CommercialModels/WebizenProVARSolutions/","title":"Webizen Pro VAR Solutions","lastUpdated":"1/9/2023","lastUpdatedAt":"2023-01-09T04:33:42.000Z","gitCreatedAt":"2023-01-09T04:33:42.000Z"}},{"frontmatter":{"title":"","draft":false},"fields":{"slug":"/SocialFactors/CommercialModels/WorkProject/","title":"The Work Project","lastUpdated":"1/24/2023","lastUpdatedAt":"2023-01-24T14:14:45.000Z","gitCreatedAt":"2023-01-09T04:33:42.000Z"}},{"frontmatter":{"title":"","draft":false},"fields":{"slug":"/SocialFactors/PeaceInfrastructureProject/AboutThePeaceInfrastructureProject/","title":"About the Peace Infrastructure Project","lastUpdated":"1/24/2023","lastUpdatedAt":"2023-01-24T14:14:45.000Z","gitCreatedAt":"2023-01-09T04:33:42.000Z"}},{"frontmatter":{"title":"","draft":false},"fields":{"slug":"/SocialFactors/SocialAttackVectors/CriminalActivity/","title":"Criminal Activity","lastUpdated":"1/9/2023","lastUpdatedAt":"2023-01-09T04:33:42.000Z","gitCreatedAt":"2023-01-09T04:33:42.000Z"}},{"frontmatter":{"title":"","draft":false},"fields":{"slug":"/SocialFactors/SocialAttackVectors/CyberAttackVectors/","title":"Cyber Attack Vectors","lastUpdated":"1/18/2023","lastUpdatedAt":"2023-01-18T05:35:20.000Z","gitCreatedAt":"2023-01-18T05:35:20.000Z"}},{"frontmatter":{"title":"","draft":false},"fields":{"slug":"/SocialFactors/SocialAttackVectors/Dishonesty/","title":"Dishonesty","lastUpdated":"1/24/2023","lastUpdatedAt":"2023-01-24T09:37:23.000Z","gitCreatedAt":"2023-01-09T04:42:32.000Z"}},{"frontmatter":{"title":"","draft":false},"fields":{"slug":"/SocialFactors/SocialAttackVectors/StrategicHarms/","title":"Strategic Harms & Exploitation","lastUpdated":"1/19/2023","lastUpdatedAt":"2023-01-19T10:09:31.000Z","gitCreatedAt":"2023-01-19T10:09:31.000Z"}},{"frontmatter":{"title":"","draft":false},"fields":{"slug":"/SocialFactors/SocialAttackVectors/Torts/","title":"Torts","lastUpdated":"1/18/2023","lastUpdatedAt":"2023-01-18T05:35:20.000Z","gitCreatedAt":"2023-01-18T05:35:20.000Z"}},{"frontmatter":{"title":"","draft":false},"fields":{"slug":"/SocialFactors/SocialAttackVectors/discriminationBasedAttacks/","title":"Discrimination based attacks.","lastUpdated":"2/3/2023","lastUpdatedAt":"2023-02-03T09:07:14.000Z","gitCreatedAt":"2023-02-03T09:07:14.000Z"}},{"frontmatter":{"title":"","draft":false},"fields":{"slug":"/SocialFactors/SocioEconomicTechReqs/AccountCreation/","title":"Account Creation","lastUpdated":"1/18/2023","lastUpdatedAt":"2023-01-18T05:35:20.000Z","gitCreatedAt":"2023-01-18T05:35:20.000Z"}},{"frontmatter":{"title":"","draft":false},"fields":{"slug":"/SocialFactors/SocioEconomicTechReqs/GuardianshipRelations/","title":"Guardianship Relations","lastUpdated":"1/18/2023","lastUpdatedAt":"2023-01-18T05:35:20.000Z","gitCreatedAt":"2023-01-12T01:59:34.000Z"}},{"frontmatter":{"title":"","draft":false},"fields":{"slug":"/SocialFactors/SocioEconomicTechReqs/GuardianshipSemantics/","title":"Guardianship Semantics","lastUpdated":"1/9/2023","lastUpdatedAt":"2023-01-09T04:33:42.000Z","gitCreatedAt":"2023-01-09T04:33:42.000Z"}},{"frontmatter":{"title":"","draft":false},"fields":{"slug":"/SocialFactors/SocioEconomicTechReqs/SupportForHumanAgency/","title":"Support for Human Agency","lastUpdated":"1/9/2023","lastUpdatedAt":"2023-01-09T04:33:42.000Z","gitCreatedAt":"2023-01-09T04:33:42.000Z"}},{"frontmatter":{"title":"","draft":false},"fields":{"slug":"/SocialFactors/WebScience/ArtificialMinds/","title":"Artificial Minds","lastUpdated":"1/9/2023","lastUpdatedAt":"2023-01-09T04:33:42.000Z","gitCreatedAt":"2023-01-09T04:33:42.000Z"}},{"frontmatter":{"title":"","draft":false},"fields":{"slug":"/SocialFactors/WebScience/CategoryTheory/","title":"Category Theory","lastUpdated":"2/5/2023","lastUpdatedAt":"2023-02-05T05:32:02.000Z","gitCreatedAt":"2023-02-05T05:32:02.000Z"}},{"frontmatter":{"title":"","draft":false},"fields":{"slug":"/SocialFactors/WebScience/Centricity/","title":"Centricity","lastUpdated":"1/9/2023","lastUpdatedAt":"2023-01-09T04:33:42.000Z","gitCreatedAt":"2023-01-09T04:33:42.000Z"}},{"frontmatter":{"title":"","draft":false},"fields":{"slug":"/SocialFactors/WebScience/HumanCentricAIEthics/","title":"Human-Centric AI Ethics","lastUpdated":"1/20/2023","lastUpdatedAt":"2023-01-20T22:14:02.000Z","gitCreatedAt":"2023-01-09T04:33:42.000Z"}},{"frontmatter":{"title":"","draft":false},"fields":{"slug":"/SocialFactors/WebScience/IdentityModelling/","title":"Identity Modelling","lastUpdated":"1/24/2023","lastUpdatedAt":"2023-01-24T09:37:23.000Z","gitCreatedAt":"2023-01-24T09:37:23.000Z"}},{"frontmatter":{"title":"","draft":false},"fields":{"slug":"/SocialFactors/WebScience/LearningModals/","title":"Learning Modals","lastUpdated":"1/19/2023","lastUpdatedAt":"2023-01-19T10:09:31.000Z","gitCreatedAt":"2023-01-09T04:33:42.000Z"}},{"frontmatter":{"title":"","draft":false},"fields":{"slug":"/SocialFactors/WebScience/SafetyProtocols/","title":"Safety Protocols","lastUpdated":"1/24/2023","lastUpdatedAt":"2023-01-24T14:14:45.000Z","gitCreatedAt":"2023-01-09T04:33:42.000Z"}},{"frontmatter":{"title":"","draft":false},"fields":{"slug":"/SocialFactors/WebScience/ScienceOfConsciousness/","title":"Science of Consciousness","lastUpdated":"1/19/2023","lastUpdatedAt":"2023-01-19T10:09:31.000Z","gitCreatedAt":"2023-01-09T04:33:42.000Z"}},{"frontmatter":{"title":"","draft":false},"fields":{"slug":"/SocialFactors/WebScience/TheValuesProject/","title":"The Values Project","lastUpdated":"1/24/2023","lastUpdatedAt":"2023-01-24T14:14:45.000Z","gitCreatedAt":"2023-01-09T04:33:42.000Z"}},{"frontmatter":{"title":"","draft":false},"fields":{"slug":"/SocialFactors/WebScience/banishmentExile/","title":"Banishment & Exile.","lastUpdated":"2/3/2023","lastUpdatedAt":"2023-02-03T09:07:14.000Z","gitCreatedAt":"2023-02-03T09:07:14.000Z"}},{"frontmatter":{"title":"","draft":false},"fields":{"slug":"/SocialFactors/WebScience/nomenclature/","title":"Nomenclature","lastUpdated":"2/5/2023","lastUpdatedAt":"2023-02-05T05:32:02.000Z","gitCreatedAt":"2023-02-05T05:32:02.000Z"}},{"frontmatter":{"title":"","draft":false},"fields":{"slug":"/WebizenTechStack/AuthenticationFabric/VerifiableCredentials/","title":"Verifiable Credentials","lastUpdated":"1/14/2023","lastUpdatedAt":"2023-01-14T07:33:42.000Z","gitCreatedAt":"2023-01-14T07:33:42.000Z"}},{"frontmatter":{"title":"","draft":false},"fields":{"slug":"/WebizenTechStack/AuthenticationFabric/WebAuthn/","title":"WebAuthn","lastUpdated":"1/9/2023","lastUpdatedAt":"2023-01-09T04:33:42.000Z","gitCreatedAt":"2023-01-09T04:33:42.000Z"}},{"frontmatter":{"title":"","draft":false},"fields":{"slug":"/WebizenTechStack/AuthenticationFabric/WebID/","title":"WebID","lastUpdated":"1/9/2023","lastUpdatedAt":"2023-01-09T04:33:42.000Z","gitCreatedAt":"2023-01-09T04:33:42.000Z"}},{"frontmatter":{"title":"","draft":false},"fields":{"slug":"/WebizenTechStack/CoreServices/Non-HTTP(s)Protocols/","title":"Non-HTTP(s) Protocols","lastUpdated":"1/19/2023","lastUpdatedAt":"2023-01-19T10:09:31.000Z","gitCreatedAt":"2023-01-09T04:33:42.000Z"}},{"frontmatter":{"title":"","draft":false},"fields":{"slug":"/WebizenTechStack/CoreServices/VerifiableClaims&Credentials/","title":"Verifiable Claims & Credentials","lastUpdated":"1/9/2023","lastUpdatedAt":"2023-01-09T04:33:42.000Z","gitCreatedAt":"2023-01-09T04:33:42.000Z"}},{"frontmatter":{"title":"","draft":false},"fields":{"slug":"/WebizenTechStack/CoreTechnologies/GoLangLibraries/","title":"GoLang Libraries","lastUpdated":"1/9/2023","lastUpdatedAt":"2023-01-09T04:33:42.000Z","gitCreatedAt":"2023-01-09T04:33:42.000Z"}},{"frontmatter":{"title":"","draft":false},"fields":{"slug":"/WebizenTechStack/CoreTechnologies/OpenBadges/","title":"Open Badges","lastUpdated":"1/9/2023","lastUpdatedAt":"2023-01-09T04:33:42.000Z","gitCreatedAt":"2023-01-09T04:33:42.000Z"}},{"frontmatter":{"title":"","draft":false},"fields":{"slug":"/WebizenTechStack/CoreTechnologies/SemanticWeb/","title":"Semantic Web","lastUpdated":"1/9/2023","lastUpdatedAt":"2023-01-09T04:33:42.000Z","gitCreatedAt":"2023-01-09T04:33:42.000Z"}},{"frontmatter":{"title":"","draft":false},"fields":{"slug":"/WebizenTechStack/CoreTechnologies/TemporalSemantics/","title":"Temporal Semantics","lastUpdated":"1/9/2023","lastUpdatedAt":"2023-01-09T04:33:42.000Z","gitCreatedAt":"2023-01-09T04:33:42.000Z"}},{"frontmatter":{"title":"","draft":false},"fields":{"slug":"/WebizenTechStack/EngineeringConsiderations/AUTHLogic/","title":"Authentication Logic","lastUpdated":"1/29/2023","lastUpdatedAt":"2023-01-29T01:31:56.000Z","gitCreatedAt":"2023-01-29T01:31:56.000Z"}},{"frontmatter":{"title":"","draft":false},"fields":{"slug":"/WebizenTechStack/EngineeringConsiderations/Containerisation/","title":"Containerisation","lastUpdated":"1/15/2023","lastUpdatedAt":"2023-01-15T11:50:09.000Z","gitCreatedAt":"2023-01-09T04:33:42.000Z"}},{"frontmatter":{"title":"","draft":false},"fields":{"slug":"/WebizenTechStack/EngineeringConsiderations/Cryptography/","title":"Cryptography","lastUpdated":"1/15/2023","lastUpdatedAt":"2023-01-15T11:50:09.000Z","gitCreatedAt":"2023-01-15T11:50:09.000Z"}},{"frontmatter":{"title":"","draft":false},"fields":{"slug":"/WebizenTechStack/EngineeringConsiderations/DatabaseRequirements/","title":"Database Requirements","lastUpdated":"1/14/2023","lastUpdatedAt":"2023-01-14T07:33:42.000Z","gitCreatedAt":"2023-01-14T07:33:42.000Z"}},{"frontmatter":{"title":"","draft":false},"fields":{"slug":"/WebizenTechStack/EngineeringConsiderations/InternetStrategy/","title":"InternetStrategy","lastUpdated":"1/29/2023","lastUpdatedAt":"2023-01-29T01:31:56.000Z","gitCreatedAt":"2023-01-29T01:31:56.000Z"}},{"frontmatter":{"title":"","draft":false},"fields":{"slug":"/WebizenTechStack/EngineeringConsiderations/MailServerLogic/","title":"Email Server Logic","lastUpdated":"1/29/2023","lastUpdatedAt":"2023-01-29T01:31:56.000Z","gitCreatedAt":"2023-01-29T01:31:56.000Z"}},{"frontmatter":{"title":"","draft":false},"fields":{"slug":"/WebizenTechStack/EngineeringConsiderations/Prolog/","title":"Prolog","lastUpdated":"1/16/2023","lastUpdatedAt":"2023-01-16T04:33:53.000Z","gitCreatedAt":"2023-01-16T04:33:53.000Z"}},{"frontmatter":{"title":"","draft":false},"fields":{"slug":"/WebizenTechStack/VocabularyModelling/ChatGPTDynamicOntology/","title":"Dynamic Ontology","lastUpdated":"1/20/2023","lastUpdatedAt":"2023-01-20T22:14:02.000Z","gitCreatedAt":"2023-01-20T22:14:02.000Z"}},{"frontmatter":{"title":"","draft":false},"fields":{"slug":"/WebizenTechStack/VocabularyModelling/OntologyAppDev/","title":"Ontology App Development","lastUpdated":"1/24/2023","lastUpdatedAt":"2023-01-24T14:14:45.000Z","gitCreatedAt":"2023-01-20T22:14:02.000Z"}},{"frontmatter":{"title":"","draft":false},"fields":{"slug":"/WebizenTechStack/VocabularyModelling/TopLevelOntologyNLPResearch/","title":"TopLevelOntologyNLPResearch","lastUpdated":"1/20/2023","lastUpdatedAt":"2023-01-20T22:14:02.000Z","gitCreatedAt":"2023-01-20T22:14:02.000Z"}},{"frontmatter":{"title":"","draft":false},"fields":{"slug":"/WebizenTechStack/Webize/BeakerBrowser/","title":"Beaker Browser (Fork)","lastUpdated":"1/30/2023","lastUpdatedAt":"2023-01-30T22:53:41.000Z","gitCreatedAt":"2023-01-30T22:53:41.000Z"}},{"frontmatter":{"title":"","draft":false},"fields":{"slug":"/WebizenTechStack/Webize/Solid/","title":"Solid","lastUpdated":"1/30/2023","lastUpdatedAt":"2023-01-30T22:53:41.000Z","gitCreatedAt":"2023-01-30T22:53:41.000Z"}},{"frontmatter":{"title":"","draft":false},"fields":{"slug":"/WebizenTechStack/Webize/Syncthing/","title":"Syncthing","lastUpdated":"1/30/2023","lastUpdatedAt":"2023-01-30T22:53:41.000Z","gitCreatedAt":"2023-01-30T22:53:41.000Z"}},{"frontmatter":{"title":"","draft":false},"fields":{"slug":"/WebizenTechStack/Webize/appy/","title":"Appy","lastUpdated":"1/30/2023","lastUpdatedAt":"2023-01-30T22:53:41.000Z","gitCreatedAt":"2023-01-30T22:53:41.000Z"}},{"frontmatter":{"title":"","draft":false},"fields":{"slug":"/WebizenTechStack/Webizen2.5/ChatGPTSupported/","title":"Chat GPT Supported Notes","lastUpdated":"1/29/2023","lastUpdatedAt":"2023-01-29T01:31:56.000Z","gitCreatedAt":"2023-01-29T01:31:56.000Z"}},{"frontmatter":{"title":"","draft":false},"fields":{"slug":"/WebizenTechStack/Webizen2.5/DevNotesWebizen2.5/","title":"DevNotesWebizen2.5","lastUpdated":"2/4/2023","lastUpdatedAt":"2023-02-04T16:41:41.000Z","gitCreatedAt":"2023-01-29T01:31:56.000Z"}},{"frontmatter":{"title":"","draft":false},"fields":{"slug":"/WebizenTechStack/Webizen2.5/FunctionalObjectives/","title":"FunctionalObjectives","lastUpdated":"1/29/2023","lastUpdatedAt":"2023-01-29T01:31:56.000Z","gitCreatedAt":"2023-01-29T01:31:56.000Z"}},{"frontmatter":{"title":"","draft":false},"fields":{"slug":"/WebizenTechStack/Webizen2.5/POCOfCoreConcepts/","title":"POC of Core Concepts","lastUpdated":"1/29/2023","lastUpdatedAt":"2023-01-29T01:31:56.000Z","gitCreatedAt":"2023-01-29T01:31:56.000Z"}},{"frontmatter":{"title":"","draft":false},"fields":{"slug":"/WebizenTechStack/Webizen2.5/Sacrifices-hardproblems/","title":"Sacrifices-Hard Problems","lastUpdated":"1/29/2023","lastUpdatedAt":"2023-01-29T01:31:56.000Z","gitCreatedAt":"2023-01-29T01:31:56.000Z"}},{"frontmatter":{"title":"","draft":false},"fields":{"slug":"/WebizenTechStack/Webizen3.0/ClientSoftwareRequirements/","title":"Client Software Requirements","lastUpdated":"1/24/2023","lastUpdatedAt":"2023-01-24T14:14:45.000Z","gitCreatedAt":"2023-01-09T04:33:42.000Z"}},{"frontmatter":{"title":"","draft":false},"fields":{"slug":"/WebizenTechStack/Webizen3.0/HostServiceRequirements/","title":"Host Software Requirements","lastUpdated":"1/14/2023","lastUpdatedAt":"2023-01-14T07:33:42.000Z","gitCreatedAt":"2023-01-09T04:33:42.000Z"}},{"frontmatter":{"title":"","draft":false},"fields":{"slug":"/WebizenTechStack/Webizen3.0/HyperMediaContainers/","title":"HyperMedia Containers","lastUpdated":"1/9/2023","lastUpdatedAt":"2023-01-09T04:33:42.000Z","gitCreatedAt":"2023-01-09T04:33:42.000Z"}},{"frontmatter":{"title":"","draft":false},"fields":{"slug":"/WebizenTechStack/Webizen3.5/AICapabilities/","title":"AI Capabilities","lastUpdated":"1/9/2023","lastUpdatedAt":"2023-01-09T04:33:42.000Z","gitCreatedAt":"2023-01-09T04:33:42.000Z"}},{"frontmatter":{"title":"","draft":false},"fields":{"slug":"/WebizenTechStack/Webizen3.5/WebOfThings(IoT)/","title":"Web Of Things (IoT)","lastUpdated":"1/9/2023","lastUpdatedAt":"2023-01-09T04:33:42.000Z","gitCreatedAt":"2023-01-09T04:33:42.000Z"}},{"frontmatter":{"title":"","draft":false},"fields":{"slug":"/WebizenTechStack/Webizen3.5/WebizenAiOS-Platform/","title":"Webizen AI OS Platform","lastUpdated":"1/9/2023","lastUpdatedAt":"2023-01-09T04:33:42.000Z","gitCreatedAt":"2023-01-09T04:33:42.000Z"}},{"frontmatter":{"title":"","draft":false},"fields":{"slug":"/WebizenTechStack/Webizen3.5/WebizenProSeries/","title":"Webizen Pro Series","lastUpdated":"1/9/2023","lastUpdatedAt":"2023-01-09T04:33:42.000Z","gitCreatedAt":"2023-01-09T04:33:42.000Z"}},{"frontmatter":{"title":"","draft":false},"fields":{"slug":"/WebizenTechStack/Webizen3.5/WebizenVision/","title":"Webizen Vision","lastUpdated":"1/9/2023","lastUpdatedAt":"2023-01-09T04:33:42.000Z","gitCreatedAt":"2023-01-09T04:33:42.000Z"}},{"frontmatter":{"title":"","draft":false},"fields":{"slug":"/WebizenTechStack/Webizen4.0/MyWebizen/","title":"MyWebizen","lastUpdated":"1/12/2023","lastUpdatedAt":"2023-01-12T03:09:19.000Z","gitCreatedAt":"2023-01-09T04:33:42.000Z"}},{"frontmatter":{"title":"","draft":false},"fields":{"slug":"/WebizenTechStack/WebizenApps/Historical RWW Apps/","title":"Historical RWW Apps","lastUpdated":"1/9/2023","lastUpdatedAt":"2023-01-09T05:17:16.000Z","gitCreatedAt":"2023-01-09T04:33:42.000Z"}},{"frontmatter":{"title":"","draft":false},"fields":{"slug":"/WebizenTechStack/WebizenApps/Webizen3.0Apps/","title":"Webizen3.0Apps","lastUpdated":"2/5/2023","lastUpdatedAt":"2023-02-05T05:32:02.000Z","gitCreatedAt":"2023-01-09T04:33:42.000Z"}},{"frontmatter":{"title":"","draft":false},"fields":{"slug":"/WebizenTechStack/WebizenApps/Webizen3.5Apps/","title":"Webizen 3.5 Apps","lastUpdated":"1/9/2023","lastUpdatedAt":"2023-01-09T04:33:42.000Z","gitCreatedAt":"2023-01-09T04:33:42.000Z"}},{"frontmatter":{"title":"","draft":false},"fields":{"slug":"/WebizenTechStack/WebizenApps/WebizenInterfaces/","title":"Webizen Interfaces","lastUpdated":"1/15/2023","lastUpdatedAt":"2023-01-15T11:50:09.000Z","gitCreatedAt":"2023-01-15T11:50:09.000Z"}},{"frontmatter":{"title":"about","draft":false},"fields":{"slug":"/old-work-archives/2018-webizen-net-au/about/","title":"about","lastUpdated":"12/30/2022","lastUpdatedAt":"2022-12-30T12:05:42.000Z","gitCreatedAt":"2022-12-28T17:37:56.000Z"}},{"frontmatter":{"title":"Resource Library","draft":false},"fields":{"slug":"/old-work-archives/2018-webizen-net-au/resource-library/","title":"Resource Library","lastUpdated":"12/30/2022","lastUpdatedAt":"2022-12-30T11:53:44.000Z","gitCreatedAt":"2022-12-28T17:37:56.000Z"}},{"frontmatter":{"title":"","draft":false},"fields":{"slug":"/old-work-archives/LinkedInArticles/AI&SoftwareAgentsSocial-Engineering Considerations/","title":"AI & Software Agents: Social-Engineering Considerations","lastUpdated":"1/18/2023","lastUpdatedAt":"2023-01-18T10:51:50.000Z","gitCreatedAt":"2023-01-18T10:51:50.000Z"}},{"frontmatter":{"title":"","draft":false},"fields":{"slug":"/old-work-archives/LinkedInArticles/LinkedInLabellingAiAgents/","title":"Knowledge & Agent Labelling: Clear Labelling of AI Interactions & some ideas about how to test students, by AI.","lastUpdated":"1/18/2023","lastUpdatedAt":"2023-01-18T10:51:50.000Z","gitCreatedAt":"2023-01-18T10:51:50.000Z"}},{"frontmatter":{"title":"","draft":false},"fields":{"slug":"/old-work-archives/LinkedInArticles/ReinventingTheKindnessEquation/","title":"Reinventing the Kindness Equation","lastUpdated":"1/18/2023","lastUpdatedAt":"2023-01-18T10:51:50.000Z","gitCreatedAt":"2023-01-18T10:51:50.000Z"}},{"frontmatter":{"title":"","draft":false},"fields":{"slug":"/old-work-archives/LinkedInArticles/WhatIsTheDefinitionOfAnAIWeapon/","title":"What is the Definition of an 'AI Weapon'","lastUpdated":"1/18/2023","lastUpdatedAt":"2023-01-18T10:51:50.000Z","gitCreatedAt":"2023-01-18T10:51:50.000Z"}},{"frontmatter":{"title":"","draft":false},"fields":{"slug":"/old-work-archives/LinkedInArticles/linkedinNoteAIDigitalIdentity&Guardianship Systems/","title":"AI, Digital Identity & Guardianship Systems?","lastUpdated":"1/18/2023","lastUpdatedAt":"2023-01-18T10:51:50.000Z","gitCreatedAt":"2023-01-18T10:51:50.000Z"}},{"frontmatter":{"title":"","draft":false},"fields":{"slug":"/PermissiveCommons/PCTOntologyModelling/OntologyWork/OWL/","title":"OWL","lastUpdated":"1/20/2023","lastUpdatedAt":"2023-01-20T22:14:02.000Z","gitCreatedAt":"2023-01-20T22:14:02.000Z"}},{"frontmatter":{"title":"","draft":false},"fields":{"slug":"/PermissiveCommons/PermissiveCommonsTech/PCTRequirements/PCT-Core-Services/","title":"PCT-Core-Services","lastUpdated":"1/19/2023","lastUpdatedAt":"2023-01-19T10:09:31.000Z","gitCreatedAt":"2023-01-19T10:09:31.000Z"}},{"frontmatter":{"title":"","draft":false},"fields":{"slug":"/PermissiveCommons/PermissiveCommonsTech/PCTRequirements/PCTEngineeringConsiderations/","title":"Engineering Considerations","lastUpdated":"1/19/2023","lastUpdatedAt":"2023-01-19T10:09:31.000Z","gitCreatedAt":"2023-01-19T10:09:31.000Z"}},{"frontmatter":{"title":"","draft":false},"fields":{"slug":"/PermissiveCommons/PermissiveCommonsTech/PCTRequirements/PCTREADME/","title":"Permissive Commons Technology Docs","lastUpdated":"1/30/2023","lastUpdatedAt":"2023-01-30T22:53:41.000Z","gitCreatedAt":"2023-01-19T10:09:31.000Z"}},{"frontmatter":{"title":"","draft":false},"fields":{"slug":"/PermissiveCommons/PermissiveCommonsTech/PCTRequirements/PCTSpecifications/","title":"PCTSpecifications","lastUpdated":"1/19/2023","lastUpdatedAt":"2023-01-19T10:09:31.000Z","gitCreatedAt":"2023-01-19T10:09:31.000Z"}},{"frontmatter":{"title":"","draft":false},"fields":{"slug":"/PermissiveCommons/PermissiveCommonsTech/PCTRequirements/PCT_PeaceInfrastructureProjectRequirements/","title":"PCT_PeaceInfrastructureProjectRequirements","lastUpdated":"1/19/2023","lastUpdatedAt":"2023-01-19T10:09:31.000Z","gitCreatedAt":"2023-01-19T10:09:31.000Z"}},{"frontmatter":{"title":"","draft":false},"fields":{"slug":"/PermissiveCommons/PermissiveCommonsTech/PCTRequirements/PCTuse-cases/","title":"Use Cases","lastUpdated":"1/30/2023","lastUpdatedAt":"2023-01-30T22:53:41.000Z","gitCreatedAt":"2023-01-19T10:09:31.000Z"}},{"frontmatter":{"title":"","draft":false},"fields":{"slug":"/PermissiveCommons/PermissiveCommonsTech/PCTWorkInProgress/CollectExistingOntologies/","title":"Collect Existing Ontologies","lastUpdated":"1/19/2023","lastUpdatedAt":"2023-01-19T10:09:31.000Z","gitCreatedAt":"2023-01-19T10:09:31.000Z"}},{"frontmatter":{"title":"","draft":false},"fields":{"slug":"/PermissiveCommons/PermissiveCommonsTech/PCTWorkInProgress/DIDsEval/","title":"DIDsEval","lastUpdated":"1/19/2023","lastUpdatedAt":"2023-01-19T10:09:31.000Z","gitCreatedAt":"2023-01-19T10:09:31.000Z"}},{"frontmatter":{"title":"","draft":false},"fields":{"slug":"/PermissiveCommons/PermissiveCommonsTech/PCTWorkInProgress/RDF2MD-Example/","title":"Ontology in Markdown Example","lastUpdated":"1/19/2023","lastUpdatedAt":"2023-01-19T10:09:31.000Z","gitCreatedAt":"2023-01-19T10:09:31.000Z"}},{"frontmatter":{"title":"","draft":false},"fields":{"slug":"/PermissiveCommons/PermissiveCommonsTech/PCTWorkInProgress/SafetyConsiderations/","title":"Safety Considerations","lastUpdated":"1/30/2023","lastUpdatedAt":"2023-01-30T22:53:41.000Z","gitCreatedAt":"2023-01-19T10:09:31.000Z"}},{"frontmatter":{"title":"","draft":false},"fields":{"slug":"/SocialFactors/CommercialModels/Currencies/FinancialPaymentTypes/","title":"Financial Payment Types","lastUpdated":"1/19/2023","lastUpdatedAt":"2023-01-19T10:09:31.000Z","gitCreatedAt":"2023-01-09T04:33:42.000Z"}},{"frontmatter":{"title":"","draft":false},"fields":{"slug":"/SocialFactors/CommercialModels/Currencies/GiftsAndDonations/","title":"Gifts and Donations","lastUpdated":"1/9/2023","lastUpdatedAt":"2023-01-09T04:33:42.000Z","gitCreatedAt":"2023-01-09T04:33:42.000Z"}},{"frontmatter":{"title":"","draft":false},"fields":{"slug":"/SocialFactors/CommercialModels/Currencies/Micropayments/","title":"Micro Payments","lastUpdated":"1/9/2023","lastUpdatedAt":"2023-01-09T04:33:42.000Z","gitCreatedAt":"2023-01-09T04:33:42.000Z"}},{"frontmatter":{"title":"","draft":false},"fields":{"slug":"/SocialFactors/CommercialModels/Currencies/Non-FinancialCurrencies/","title":"Non-Financial Currencies","lastUpdated":"1/9/2023","lastUpdatedAt":"2023-01-09T04:33:42.000Z","gitCreatedAt":"2023-01-09T04:33:42.000Z"}},{"frontmatter":{"title":"","draft":false},"fields":{"slug":"/SocialFactors/CommercialModels/ESG/BiosphereCalcs/","title":"Biosphere Calcs","lastUpdated":"1/9/2023","lastUpdatedAt":"2023-01-09T04:33:42.000Z","gitCreatedAt":"2023-01-09T04:33:42.000Z"}},{"frontmatter":{"title":"","draft":false},"fields":{"slug":"/SocialFactors/CommercialModels/ESG/EnergyCalcs/","title":"Energy Calcs","lastUpdated":"1/24/2023","lastUpdatedAt":"2023-01-24T14:14:45.000Z","gitCreatedAt":"2023-01-09T04:33:42.000Z"}},{"frontmatter":{"title":"","draft":false},"fields":{"slug":"/SocialFactors/CommercialModels/ESG/SocioshereCalcs/","title":"Sociosphere Calcs","lastUpdated":"1/19/2023","lastUpdatedAt":"2023-01-19T10:09:31.000Z","gitCreatedAt":"2023-01-09T04:33:42.000Z"}},{"frontmatter":{"title":"","draft":false},"fields":{"slug":"/SocialFactors/CommercialModels/Historical Information/Domains/","title":"Domains","lastUpdated":"1/9/2023","lastUpdatedAt":"2023-01-09T04:33:42.000Z","gitCreatedAt":"2023-01-09T04:33:42.000Z"}},{"frontmatter":{"title":"","draft":false},"fields":{"slug":"/SocialFactors/CommercialModels/Historical Information/ValueAccountingInitiatives/","title":"Value Accounting Initiatives","lastUpdated":"1/9/2023","lastUpdatedAt":"2023-01-09T04:33:42.000Z","gitCreatedAt":"2023-01-09T04:33:42.000Z"}},{"frontmatter":{"title":"","draft":false},"fields":{"slug":"/SocialFactors/CommercialModels/Historical Information/WebCivics/","title":"Web Civics","lastUpdated":"1/18/2023","lastUpdatedAt":"2023-01-18T10:51:50.000Z","gitCreatedAt":"2023-01-09T04:33:42.000Z"}},{"frontmatter":{"title":"","draft":false},"fields":{"slug":"/SocialFactors/CommercialModels/WebizenAlliance/CommunityOfPractice/","title":"Community of Practice","lastUpdated":"1/9/2023","lastUpdatedAt":"2023-01-09T04:33:42.000Z","gitCreatedAt":"2023-01-09T04:33:42.000Z"}},{"frontmatter":{"title":"","draft":false},"fields":{"slug":"/SocialFactors/CommercialModels/WebizenAlliance/EarlyStageIncomeStrategies/","title":"Early Stage Income Strategies","lastUpdated":"1/9/2023","lastUpdatedAt":"2023-01-09T04:33:42.000Z","gitCreatedAt":"2023-01-09T04:33:42.000Z"}},{"frontmatter":{"title":"","draft":false},"fields":{"slug":"/SocialFactors/CommercialModels/WebizenAlliance/TheWebizenCharter/","title":"The Webizen Charter","lastUpdated":"1/24/2023","lastUpdatedAt":"2023-01-24T14:14:45.000Z","gitCreatedAt":"2023-01-09T04:33:42.000Z"}},{"frontmatter":{"title":"","draft":false},"fields":{"slug":"/SocialFactors/CommercialModels/WebizenAlliance/WebizenAllianceHostProviders/","title":"Webizen Host Providers","lastUpdated":"1/30/2023","lastUpdatedAt":"2023-01-30T22:53:41.000Z","gitCreatedAt":"2023-01-29T01:31:56.000Z"}},{"frontmatter":{"title":"","draft":false},"fields":{"slug":"/SocialFactors/CommercialModels/WebizenProUsecases/WebizenProEcosystemUsecases/","title":"Webizen Pro Ecosystem Usecases","lastUpdated":"1/9/2023","lastUpdatedAt":"2023-01-09T04:33:42.000Z","gitCreatedAt":"2023-01-09T04:33:42.000Z"}},{"frontmatter":{"title":"","draft":false},"fields":{"slug":"/SocialFactors/CommercialModels/WebizenProUsecases/WebizenProEdgeUseCases/","title":"Webizen Pro Edge UseCases","lastUpdated":"1/9/2023","lastUpdatedAt":"2023-01-09T04:33:42.000Z","gitCreatedAt":"2023-01-09T04:33:42.000Z"}},{"frontmatter":{"title":"","draft":false},"fields":{"slug":"/SocialFactors/CommercialModels/WebizenProUsecases/WebizenProUse-Cases/","title":"Webizen Pro Use-Cases","lastUpdated":"1/9/2023","lastUpdatedAt":"2023-01-09T04:33:42.000Z","gitCreatedAt":"2023-01-09T04:33:42.000Z"}},{"frontmatter":{"title":"","draft":false},"fields":{"slug":"/SocialFactors/CommercialModels/WorkProject/ContributionClassifications/","title":"Contribution Classifications","lastUpdated":"1/9/2023","lastUpdatedAt":"2023-01-09T04:33:42.000Z","gitCreatedAt":"2023-01-09T04:33:42.000Z"}},{"frontmatter":{"title":"","draft":false},"fields":{"slug":"/SocialFactors/CommercialModels/WorkProject/EquipmentAndSupplies/","title":"Equipment and Supplies","lastUpdated":"1/9/2023","lastUpdatedAt":"2023-01-09T04:33:42.000Z","gitCreatedAt":"2023-01-09T04:33:42.000Z"}},{"frontmatter":{"title":"","draft":false},"fields":{"slug":"/SocialFactors/CommercialModels/WorkProject/IntellectualProperty/","title":"Intellectual Property","lastUpdated":"1/9/2023","lastUpdatedAt":"2023-01-09T04:33:42.000Z","gitCreatedAt":"2023-01-09T04:33:42.000Z"}},{"frontmatter":{"title":"","draft":false},"fields":{"slug":"/SocialFactors/CommercialModels/WorkProject/KnowledgeWork/","title":"Knowledge Work","lastUpdated":"1/9/2023","lastUpdatedAt":"2023-01-09T04:33:42.000Z","gitCreatedAt":"2023-01-09T04:33:42.000Z"}},{"frontmatter":{"title":"","draft":false},"fields":{"slug":"/SocialFactors/CommercialModels/WorkProject/LabourWork/","title":"Labour Work","lastUpdated":"1/9/2023","lastUpdatedAt":"2023-01-09T04:33:42.000Z","gitCreatedAt":"2023-01-09T04:33:42.000Z"}},{"frontmatter":{"title":"","draft":false},"fields":{"slug":"/SocialFactors/CommercialModels/WorkProject/LicensingFrameworks/","title":"Licensing Frameworks","lastUpdated":"1/24/2023","lastUpdatedAt":"2023-01-24T14:14:45.000Z","gitCreatedAt":"2023-01-09T04:33:42.000Z"}},{"frontmatter":{"title":"","draft":false},"fields":{"slug":"/SocialFactors/CommercialModels/WorkProject/ProjectFinancing/","title":"Project Financing","lastUpdated":"1/24/2023","lastUpdatedAt":"2023-01-24T14:14:45.000Z","gitCreatedAt":"2023-01-09T04:33:42.000Z"}},{"frontmatter":{"title":"","draft":false},"fields":{"slug":"/SocialFactors/CommercialModels/WorkProject/Resources/","title":"Resources","lastUpdated":"1/9/2023","lastUpdatedAt":"2023-01-09T04:33:42.000Z","gitCreatedAt":"2023-01-09T04:33:42.000Z"}},{"frontmatter":{"title":"","draft":false},"fields":{"slug":"/SocialFactors/CommercialModels/WorkProject/WorkValuationMethods/","title":"Work Valuation Methods","lastUpdated":"1/9/2023","lastUpdatedAt":"2023-01-09T04:33:42.000Z","gitCreatedAt":"2023-01-09T04:33:42.000Z"}},{"frontmatter":{"title":"","draft":false},"fields":{"slug":"/SocialFactors/SocialAttackVectors/CriminalActivity/CorporateCrime/","title":"Corporate Crime","lastUpdated":"1/9/2023","lastUpdatedAt":"2023-01-09T04:33:42.000Z","gitCreatedAt":"2023-01-09T04:33:42.000Z"}},{"frontmatter":{"title":"","draft":false},"fields":{"slug":"/SocialFactors/SocialAttackVectors/CriminalActivity/EnvironmentalCrime/","title":"Environmental Crime","lastUpdated":"1/18/2023","lastUpdatedAt":"2023-01-18T05:35:20.000Z","gitCreatedAt":"2023-01-18T05:35:20.000Z"}},{"frontmatter":{"title":"","draft":false},"fields":{"slug":"/SocialFactors/SocialAttackVectors/CriminalActivity/FinancialCrimes/","title":"Financial Crimes","lastUpdated":"1/9/2023","lastUpdatedAt":"2023-01-09T04:33:42.000Z","gitCreatedAt":"2023-01-09T04:33:42.000Z"}},{"frontmatter":{"title":"","draft":false},"fields":{"slug":"/SocialFactors/SocialAttackVectors/CriminalActivity/Fraud/","title":"Fraud","lastUpdated":"1/9/2023","lastUpdatedAt":"2023-01-09T04:33:42.000Z","gitCreatedAt":"2023-01-09T04:33:42.000Z"}},{"frontmatter":{"title":"","draft":false},"fields":{"slug":"/SocialFactors/SocialAttackVectors/CriminalActivity/ProxyAttacks/","title":"Proxy Attacks","lastUpdated":"1/18/2023","lastUpdatedAt":"2023-01-18T05:35:20.000Z","gitCreatedAt":"2023-01-18T05:35:20.000Z"}},{"frontmatter":{"title":"","draft":false},"fields":{"slug":"/SocialFactors/SocialAttackVectors/CyberAttackVectors/AttacksOnline/","title":"Attacks Online","lastUpdated":"1/18/2023","lastUpdatedAt":"2023-01-18T05:35:20.000Z","gitCreatedAt":"2023-01-18T05:35:20.000Z"}},{"frontmatter":{"title":"","draft":false},"fields":{"slug":"/SocialFactors/SocialAttackVectors/CyberAttackVectors/CyberCrime/","title":"Cyber Crime","lastUpdated":"1/18/2023","lastUpdatedAt":"2023-01-18T05:35:20.000Z","gitCreatedAt":"2023-01-18T05:35:20.000Z"}},{"frontmatter":{"title":"","draft":false},"fields":{"slug":"/SocialFactors/SocialAttackVectors/CyberAttackVectors/DataBaseAttacks/","title":"Database Attacks","lastUpdated":"1/20/2023","lastUpdatedAt":"2023-01-20T22:14:02.000Z","gitCreatedAt":"2023-01-20T22:14:02.000Z"}},{"frontmatter":{"title":"","draft":false},"fields":{"slug":"/SocialFactors/SocialAttackVectors/CyberAttackVectors/DeepFakes/","title":"DeepFakes","lastUpdated":"1/24/2023","lastUpdatedAt":"2023-01-24T14:14:45.000Z","gitCreatedAt":"2023-01-19T10:09:31.000Z"}},{"frontmatter":{"title":"","draft":false},"fields":{"slug":"/SocialFactors/SocialAttackVectors/CyberAttackVectors/DigitalSlavery/","title":"Digital Slavery","lastUpdated":"1/20/2023","lastUpdatedAt":"2023-01-20T22:14:02.000Z","gitCreatedAt":"2023-01-20T22:14:02.000Z"}},{"frontmatter":{"title":"","draft":false},"fields":{"slug":"/SocialFactors/SocialAttackVectors/CyberAttackVectors/MisRepresentation/","title":"MisRepresentation","lastUpdated":"1/24/2023","lastUpdatedAt":"2023-01-24T09:37:23.000Z","gitCreatedAt":"2023-01-24T09:37:23.000Z"}},{"frontmatter":{"title":"","draft":false},"fields":{"slug":"/SocialFactors/SocialAttackVectors/CyberAttackVectors/NobodyAI/","title":"NobodyAI","lastUpdated":"1/18/2023","lastUpdatedAt":"2023-01-18T05:35:20.000Z","gitCreatedAt":"2023-01-18T05:35:20.000Z"}},{"frontmatter":{"title":"","draft":false},"fields":{"slug":"/SocialFactors/SocialAttackVectors/CyberAttackVectors/TechDebt/","title":"Tech Debt","lastUpdated":"1/18/2023","lastUpdatedAt":"2023-01-18T05:35:20.000Z","gitCreatedAt":"2023-01-18T05:35:20.000Z"}},{"frontmatter":{"title":"","draft":false},"fields":{"slug":"/SocialFactors/SocialAttackVectors/CyberAttackVectors/permanentIdentifiers/","title":"Permanent Identifiers","lastUpdated":"1/20/2023","lastUpdatedAt":"2023-01-20T22:14:02.000Z","gitCreatedAt":"2023-01-20T22:14:02.000Z"}},{"frontmatter":{"title":"","draft":false},"fields":{"slug":"/SocialFactors/SocialAttackVectors/StrategicHarms/AcademicInstitutionalFunnelling/","title":"Academic / Institutional Funnelling","lastUpdated":"1/24/2023","lastUpdatedAt":"2023-01-24T09:37:23.000Z","gitCreatedAt":"2023-01-24T09:37:23.000Z"}},{"frontmatter":{"title":"","draft":false},"fields":{"slug":"/SocialFactors/SocialAttackVectors/StrategicHarms/AuthorisedThinkers/","title":"Authorised Thinkers","lastUpdated":"1/24/2023","lastUpdatedAt":"2023-01-24T09:37:23.000Z","gitCreatedAt":"2023-01-24T09:37:23.000Z"}},{"frontmatter":{"title":"","draft":false},"fields":{"slug":"/SocialFactors/SocialAttackVectors/StrategicHarms/BrainRape/","title":"Brain Rape","lastUpdated":"1/24/2023","lastUpdatedAt":"2023-01-24T09:37:23.000Z","gitCreatedAt":"2023-01-24T09:37:23.000Z"}},{"frontmatter":{"title":"","draft":false},"fields":{"slug":"/SocialFactors/SocialAttackVectors/StrategicHarms/CommercialExploitation/","title":"Commercial Exploitation","lastUpdated":"1/24/2023","lastUpdatedAt":"2023-01-24T09:37:23.000Z","gitCreatedAt":"2023-01-24T09:37:23.000Z"}},{"frontmatter":{"title":"","draft":false},"fields":{"slug":"/SocialFactors/SocialAttackVectors/StrategicHarms/Compromise/","title":"Compromise","lastUpdated":"1/24/2023","lastUpdatedAt":"2023-01-24T09:37:23.000Z","gitCreatedAt":"2023-01-24T09:37:23.000Z"}},{"frontmatter":{"title":"","draft":false},"fields":{"slug":"/SocialFactors/SocialAttackVectors/StrategicHarms/Dehumanisation/","title":"Dehumanisation","lastUpdated":"1/19/2023","lastUpdatedAt":"2023-01-19T10:09:31.000Z","gitCreatedAt":"2023-01-19T10:09:31.000Z"}},{"frontmatter":{"title":"","draft":false},"fields":{"slug":"/SocialFactors/SocialAttackVectors/StrategicHarms/FakeNews/","title":"Fake News","lastUpdated":"1/19/2023","lastUpdatedAt":"2023-01-19T10:09:31.000Z","gitCreatedAt":"2023-01-19T10:09:31.000Z"}},{"frontmatter":{"title":"","draft":false},"fields":{"slug":"/SocialFactors/SocialAttackVectors/StrategicHarms/FalseAttribution/","title":"False Attribution","lastUpdated":"1/19/2023","lastUpdatedAt":"2023-01-19T10:09:31.000Z","gitCreatedAt":"2023-01-19T10:09:31.000Z"}},{"frontmatter":{"title":"","draft":false},"fields":{"slug":"/SocialFactors/SocialAttackVectors/StrategicHarms/Impairment/","title":"Impairment","lastUpdated":"1/24/2023","lastUpdatedAt":"2023-01-24T09:37:23.000Z","gitCreatedAt":"2023-01-24T09:37:23.000Z"}},{"frontmatter":{"title":"","draft":false},"fields":{"slug":"/SocialFactors/SocialAttackVectors/StrategicHarms/Manipulation/","title":"Manipulation","lastUpdated":"1/24/2023","lastUpdatedAt":"2023-01-24T09:37:23.000Z","gitCreatedAt":"2023-01-24T09:37:23.000Z"}},{"frontmatter":{"title":"","draft":false},"fields":{"slug":"/SocialFactors/SocialAttackVectors/StrategicHarms/MustBeFamous/","title":"You Must Be Famous!!!","lastUpdated":"1/19/2023","lastUpdatedAt":"2023-01-19T10:09:31.000Z","gitCreatedAt":"2023-01-19T10:09:31.000Z"}},{"frontmatter":{"title":"","draft":false},"fields":{"slug":"/SocialFactors/SocialAttackVectors/StrategicHarms/PsychologicalAttack/","title":"Psychological Attack & PsyOps","lastUpdated":"1/24/2023","lastUpdatedAt":"2023-01-24T09:37:23.000Z","gitCreatedAt":"2023-01-24T09:37:23.000Z"}},{"frontmatter":{"title":"","draft":false},"fields":{"slug":"/SocialFactors/SocialAttackVectors/StrategicHarms/PublicSectorWrongDoings/","title":"Public Sector Wrong Doings","lastUpdated":"1/19/2023","lastUpdatedAt":"2023-01-19T10:09:31.000Z","gitCreatedAt":"2023-01-19T10:09:31.000Z"}},{"frontmatter":{"title":"","draft":false},"fields":{"slug":"/SocialFactors/SocialAttackVectors/StrategicHarms/Reversal/","title":"Reversal","lastUpdated":"1/29/2023","lastUpdatedAt":"2023-01-29T01:31:56.000Z","gitCreatedAt":"2023-01-29T01:31:56.000Z"}},{"frontmatter":{"title":"","draft":false},"fields":{"slug":"/SocialFactors/SocialAttackVectors/StrategicHarms/SocialContractGamification/","title":"Social Contract Gamification","lastUpdated":"2/3/2023","lastUpdatedAt":"2023-02-03T09:07:14.000Z","gitCreatedAt":"2023-02-03T09:07:14.000Z"}},{"frontmatter":{"title":"","draft":false},"fields":{"slug":"/SocialFactors/SocialAttackVectors/StrategicHarms/TemporalAttacks/","title":"TemporalAttacks","lastUpdated":"1/19/2023","lastUpdatedAt":"2023-01-19T10:09:31.000Z","gitCreatedAt":"2023-01-19T10:09:31.000Z"}},{"frontmatter":{"title":"","draft":false},"fields":{"slug":"/SocialFactors/SocialAttackVectors/StrategicHarms/TheHarvester/","title":"The Harvester","lastUpdated":"1/19/2023","lastUpdatedAt":"2023-01-19T10:09:31.000Z","gitCreatedAt":"2023-01-19T10:09:31.000Z"}},{"frontmatter":{"title":"","draft":false},"fields":{"slug":"/SocialFactors/SocialAttackVectors/StrategicHarms/TheSecret/","title":"\"The Secret\"","lastUpdated":"1/19/2023","lastUpdatedAt":"2023-01-19T10:09:31.000Z","gitCreatedAt":"2023-01-19T10:09:31.000Z"}},{"frontmatter":{"title":"","draft":false},"fields":{"slug":"/SocialFactors/SocialAttackVectors/Torts/EconomicTorts/","title":"Economic Torts","lastUpdated":"1/18/2023","lastUpdatedAt":"2023-01-18T05:35:20.000Z","gitCreatedAt":"2023-01-18T05:35:20.000Z"}},{"frontmatter":{"title":"","draft":false},"fields":{"slug":"/SocialFactors/SocialAttackVectors/Torts/IntentionalTorts/","title":"Intentional Torts","lastUpdated":"1/18/2023","lastUpdatedAt":"2023-01-18T05:35:20.000Z","gitCreatedAt":"2023-01-18T05:35:20.000Z"}},{"frontmatter":{"title":"","draft":false},"fields":{"slug":"/SocialFactors/SocialAttackVectors/Torts/Negligence/","title":"Negligence","lastUpdated":"1/18/2023","lastUpdatedAt":"2023-01-18T05:35:20.000Z","gitCreatedAt":"2023-01-18T05:35:20.000Z"}},{"frontmatter":{"title":"","draft":false},"fields":{"slug":"/SocialFactors/SocialAttackVectors/Torts/Nuisance/","title":"Nuisance","lastUpdated":"1/18/2023","lastUpdatedAt":"2023-01-18T05:35:20.000Z","gitCreatedAt":"2023-01-18T05:35:20.000Z"}},{"frontmatter":{"title":"","draft":false},"fields":{"slug":"/SocialFactors/WebScience/ArtificialMinds/AChatGPTExperimentHolborn/","title":"A ChatGPT Experiment: Holborn","lastUpdated":"1/18/2023","lastUpdatedAt":"2023-01-18T05:35:20.000Z","gitCreatedAt":"2023-01-16T08:47:26.000Z"}},{"frontmatter":{"title":"","draft":false},"fields":{"slug":"/SocialFactors/WebScience/ArtificialMinds/BotScience/","title":"BotScience","lastUpdated":"2/5/2023","lastUpdatedAt":"2023-02-05T05:32:02.000Z","gitCreatedAt":"2023-02-03T09:07:14.000Z"}},{"frontmatter":{"title":"","draft":false},"fields":{"slug":"/SocialFactors/WebScience/ArtificialMinds/CognitiveAI/","title":"Cognitive AI","lastUpdated":"1/24/2023","lastUpdatedAt":"2023-01-24T14:14:45.000Z","gitCreatedAt":"2023-01-18T16:25:14.000Z"}},{"frontmatter":{"title":"","draft":false},"fields":{"slug":"/SocialFactors/WebScience/ArtificialMinds/TheArtificialMindsIndex/","title":"The Artificial Minds List","lastUpdated":"1/9/2023","lastUpdatedAt":"2023-01-09T04:33:42.000Z","gitCreatedAt":"2023-01-09T04:33:42.000Z"}},{"frontmatter":{"title":"","draft":false},"fields":{"slug":"/SocialFactors/WebScience/ArtificialMinds/TheWebizenAgent/","title":"The Webizen Agent","lastUpdated":"1/30/2023","lastUpdatedAt":"2023-01-30T22:53:41.000Z","gitCreatedAt":"2023-01-30T22:53:41.000Z"}},{"frontmatter":{"title":"","draft":false},"fields":{"slug":"/SocialFactors/WebScience/SafetyProtocols/AgentLabelling/","title":"Agent Labelling","lastUpdated":"1/14/2023","lastUpdatedAt":"2023-01-14T07:33:42.000Z","gitCreatedAt":"2023-01-12T01:59:34.000Z"}},{"frontmatter":{"title":"","draft":false},"fields":{"slug":"/SocialFactors/WebScience/SafetyProtocols/DataPortability/","title":"Data Portability","lastUpdated":"1/24/2023","lastUpdatedAt":"2023-01-24T14:14:45.000Z","gitCreatedAt":"2023-01-09T04:33:42.000Z"}},{"frontmatter":{"title":"","draft":false},"fields":{"slug":"/SocialFactors/WebScience/SafetyProtocols/EndingDigitalSlavery/","title":"Ending Digital Slavery","lastUpdated":"1/18/2023","lastUpdatedAt":"2023-01-18T05:35:20.000Z","gitCreatedAt":"2023-01-09T04:33:42.000Z"}},{"frontmatter":{"title":"","draft":false},"fields":{"slug":"/SocialFactors/WebScience/SafetyProtocols/FairWorkProtocols/","title":"Fair Work Protocols","lastUpdated":"1/9/2023","lastUpdatedAt":"2023-01-09T04:33:42.000Z","gitCreatedAt":"2023-01-09T04:33:42.000Z"}},{"frontmatter":{"title":"","draft":false},"fields":{"slug":"/SocialFactors/WebScience/SafetyProtocols/FreedomOfThought/","title":"Freedom of Thought","lastUpdated":"1/9/2023","lastUpdatedAt":"2023-01-09T04:33:42.000Z","gitCreatedAt":"2023-01-09T04:33:42.000Z"}},{"frontmatter":{"title":"","draft":false},"fields":{"slug":"/SocialFactors/WebScience/SafetyProtocols/HumanCentricAI/","title":"Human Centric AI","lastUpdated":"1/24/2023","lastUpdatedAt":"2023-01-24T14:14:45.000Z","gitCreatedAt":"2023-01-09T04:33:42.000Z"}},{"frontmatter":{"title":"","draft":false},"fields":{"slug":"/SocialFactors/WebScience/SafetyProtocols/HumanCentricDigitalIdentity/","title":"HumanCentric Digital Identity","lastUpdated":"1/12/2023","lastUpdatedAt":"2023-01-12T03:09:19.000Z","gitCreatedAt":"2023-01-12T03:09:19.000Z"}},{"frontmatter":{"title":"","draft":false},"fields":{"slug":"/SocialFactors/WebScience/SafetyProtocols/KnowledgeQualificationMethods/","title":"Knowledge Qualification Methods","lastUpdated":"1/12/2023","lastUpdatedAt":"2023-01-12T03:09:19.000Z","gitCreatedAt":"2023-01-12T03:09:19.000Z"}},{"frontmatter":{"title":"","draft":false},"fields":{"slug":"/SocialFactors/WebScience/SafetyProtocols/NoLock-ins/","title":"No Lock-ins","lastUpdated":"1/9/2023","lastUpdatedAt":"2023-01-09T04:33:42.000Z","gitCreatedAt":"2023-01-09T04:33:42.000Z"}},{"frontmatter":{"title":"","draft":false},"fields":{"slug":"/SocialFactors/WebScience/SafetyProtocols/ProtectingChildren/","title":"Protecting Children","lastUpdated":"1/12/2023","lastUpdatedAt":"2023-01-12T03:09:19.000Z","gitCreatedAt":"2023-01-09T04:33:42.000Z"}},{"frontmatter":{"title":"","draft":false},"fields":{"slug":"/SocialFactors/WebScience/SafetyProtocols/Relationships(Social)/","title":"Relationships (Social)","lastUpdated":"1/24/2023","lastUpdatedAt":"2023-01-24T14:14:45.000Z","gitCreatedAt":"2023-01-09T04:42:32.000Z"}},{"frontmatter":{"title":"","draft":false},"fields":{"slug":"/SocialFactors/WebScience/SafetyProtocols/ValuesCredentials/","title":"Values Credentials","lastUpdated":"2/3/2023","lastUpdatedAt":"2023-02-03T11:21:01.000Z","gitCreatedAt":"2023-01-24T14:14:45.000Z"}},{"frontmatter":{"title":"","draft":false},"fields":{"slug":"/SocialFactors/WebScience/identityModelling/NISTIDOntology/","title":"NISTIDOntology","lastUpdated":"1/24/2023","lastUpdatedAt":"2023-01-24T09:37:23.000Z","gitCreatedAt":"2023-01-24T09:37:23.000Z"}},{"frontmatter":{"title":"","draft":false},"fields":{"slug":"/SocialFactors/WebScience/identityModelling/PersonalOntology/","title":"Personal Ontology","lastUpdated":"2/5/2023","lastUpdatedAt":"2023-02-05T05:32:02.000Z","gitCreatedAt":"2023-02-05T05:32:02.000Z"}},{"frontmatter":{"title":"","draft":false},"fields":{"slug":"/WebizenTechStack/CoreServices/Non-HTTP(s)Protocols/Chia/","title":"Chia","lastUpdated":"1/9/2023","lastUpdatedAt":"2023-01-09T04:33:42.000Z","gitCreatedAt":"2023-01-09T04:33:42.000Z"}},{"frontmatter":{"title":"","draft":false},"fields":{"slug":"/WebizenTechStack/CoreServices/Non-HTTP(s)Protocols/DAT/","title":"DAT","lastUpdated":"1/18/2023","lastUpdatedAt":"2023-01-18T16:34:54.000Z","gitCreatedAt":"2023-01-09T04:33:42.000Z"}},{"frontmatter":{"title":"","draft":false},"fields":{"slug":"/WebizenTechStack/CoreServices/Non-HTTP(s)Protocols/GIT/","title":"GIT","lastUpdated":"1/9/2023","lastUpdatedAt":"2023-01-09T04:33:42.000Z","gitCreatedAt":"2023-01-09T04:33:42.000Z"}},{"frontmatter":{"title":"","draft":false},"fields":{"slug":"/WebizenTechStack/CoreServices/Non-HTTP(s)Protocols/GUNECO/","title":"GUNECO","lastUpdated":"1/9/2023","lastUpdatedAt":"2023-01-09T04:33:42.000Z","gitCreatedAt":"2023-01-09T04:33:42.000Z"}},{"frontmatter":{"title":"","draft":false},"fields":{"slug":"/WebizenTechStack/CoreServices/Non-HTTP(s)Protocols/Hedera/","title":"Hedera","lastUpdated":"1/9/2023","lastUpdatedAt":"2023-01-09T04:33:42.000Z","gitCreatedAt":"2023-01-09T04:33:42.000Z"}},{"frontmatter":{"title":"","draft":false},"fields":{"slug":"/WebizenTechStack/CoreServices/Non-HTTP(s)Protocols/Holochain/","title":"Holochain","lastUpdated":"1/18/2023","lastUpdatedAt":"2023-01-18T16:34:54.000Z","gitCreatedAt":"2023-01-18T16:34:54.000Z"}},{"frontmatter":{"title":"","draft":false},"fields":{"slug":"/WebizenTechStack/CoreServices/Non-HTTP(s)Protocols/IOTA/","title":"IOTA","lastUpdated":"1/9/2023","lastUpdatedAt":"2023-01-09T04:33:42.000Z","gitCreatedAt":"2023-01-09T04:33:42.000Z"}},{"frontmatter":{"title":"","draft":false},"fields":{"slug":"/WebizenTechStack/CoreServices/Non-HTTP(s)Protocols/IPFS/","title":"IPFS","lastUpdated":"1/9/2023","lastUpdatedAt":"2023-01-09T04:33:42.000Z","gitCreatedAt":"2023-01-09T04:33:42.000Z"}},{"frontmatter":{"title":"","draft":false},"fields":{"slug":"/WebizenTechStack/CoreServices/Non-HTTP(s)Protocols/IPLD/","title":"IPLD","lastUpdated":"1/18/2023","lastUpdatedAt":"2023-01-18T16:34:54.000Z","gitCreatedAt":"2023-01-18T16:34:54.000Z"}},{"frontmatter":{"title":"","draft":false},"fields":{"slug":"/WebizenTechStack/CoreServices/Non-HTTP(s)Protocols/LightningNetwork/","title":"Lightning Network","lastUpdated":"1/9/2023","lastUpdatedAt":"2023-01-09T04:33:42.000Z","gitCreatedAt":"2023-01-09T04:33:42.000Z"}},{"frontmatter":{"title":"","draft":false},"fields":{"slug":"/WebizenTechStack/CoreServices/Non-HTTP(s)Protocols/NYM/","title":"NYM","lastUpdated":"1/9/2023","lastUpdatedAt":"2023-01-09T04:33:42.000Z","gitCreatedAt":"2023-01-09T04:33:42.000Z"}},{"frontmatter":{"title":"","draft":false},"fields":{"slug":"/WebizenTechStack/CoreServices/Non-HTTP(s)Protocols/WebCash/","title":"WebCash","lastUpdated":"1/9/2023","lastUpdatedAt":"2023-01-09T04:33:42.000Z","gitCreatedAt":"2023-01-09T04:33:42.000Z"}},{"frontmatter":{"title":"","draft":false},"fields":{"slug":"/WebizenTechStack/CoreServices/Non-HTTP(s)Protocols/WebRTC/","title":"WebRTC","lastUpdated":"1/9/2023","lastUpdatedAt":"2023-01-09T04:33:42.000Z","gitCreatedAt":"2023-01-09T04:33:42.000Z"}},{"frontmatter":{"title":"","draft":false},"fields":{"slug":"/WebizenTechStack/CoreServices/Non-HTTP(s)Protocols/WebSockets/","title":"WebSockets","lastUpdated":"1/9/2023","lastUpdatedAt":"2023-01-09T04:33:42.000Z","gitCreatedAt":"2023-01-09T04:33:42.000Z"}},{"frontmatter":{"title":"","draft":false},"fields":{"slug":"/WebizenTechStack/CoreServices/Non-HTTP(s)Protocols/WebTorrent/","title":"WebTorrent","lastUpdated":"1/9/2023","lastUpdatedAt":"2023-01-09T04:33:42.000Z","gitCreatedAt":"2023-01-09T04:33:42.000Z"}},{"frontmatter":{"title":"","draft":false},"fields":{"slug":"/WebizenTechStack/CoreServices/Non-HTTP(s)Protocols/WireGuard/","title":"WireGuard","lastUpdated":"1/9/2023","lastUpdatedAt":"2023-01-09T04:33:42.000Z","gitCreatedAt":"2023-01-09T04:33:42.000Z"}},{"frontmatter":{"title":"","draft":false},"fields":{"slug":"/WebizenTechStack/CoreServices/Non-HTTP(s)Protocols/XRPLedger/","title":"XRP Ledger","lastUpdated":"1/9/2023","lastUpdatedAt":"2023-01-09T04:33:42.000Z","gitCreatedAt":"2023-01-09T04:33:42.000Z"}},{"frontmatter":{"title":"","draft":false},"fields":{"slug":"/WebizenTechStack/CoreServices/Non-HTTP(s)Protocols/obyte/","title":"Obyte","lastUpdated":"1/9/2023","lastUpdatedAt":"2023-01-09T04:33:42.000Z","gitCreatedAt":"2023-01-09T04:33:42.000Z"}},{"frontmatter":{"title":"","draft":false},"fields":{"slug":"/WebizenTechStack/CoreTechnologies/SemanticWeb/GRDDL/","title":"GRDDL","lastUpdated":"1/18/2023","lastUpdatedAt":"2023-01-18T16:34:54.000Z","gitCreatedAt":"2023-01-18T16:34:54.000Z"}},{"frontmatter":{"title":"","draft":false},"fields":{"slug":"/WebizenTechStack/CoreTechnologies/SemanticWeb/SemWeb-AUTH/","title":"Semantic Web Authentication Tech","lastUpdated":"1/9/2023","lastUpdatedAt":"2023-01-09T05:17:16.000Z","gitCreatedAt":"2023-01-09T05:17:16.000Z"}},{"frontmatter":{"title":"","draft":false},"fields":{"slug":"/WebizenTechStack/CoreTechnologies/SemanticWeb/SemWebOntologies/","title":"SemWebOntologies","lastUpdated":"1/24/2023","lastUpdatedAt":"2023-01-24T14:14:45.000Z","gitCreatedAt":"2023-01-19T10:09:31.000Z"}},{"frontmatter":{"title":"","draft":false},"fields":{"slug":"/WebizenTechStack/CoreTechnologies/SemanticWeb/SparqlFamily/","title":"Sparql Family","lastUpdated":"1/14/2023","lastUpdatedAt":"2023-01-14T07:33:42.000Z","gitCreatedAt":"2023-01-14T07:33:42.000Z"}},{"frontmatter":{"title":"","draft":false},"fields":{"slug":"/WebizenTechStack/EngineeringConsiderations/InternetStrategy/DNSConsiderations/","title":"DNS Considerations","lastUpdated":"1/29/2023","lastUpdatedAt":"2023-01-29T01:31:56.000Z","gitCreatedAt":"2023-01-29T01:31:56.000Z"}},{"frontmatter":{"title":"","draft":false},"fields":{"slug":"/WebizenTechStack/EngineeringConsiderations/InternetStrategy/InternetSummaryInfo/","title":"General Internet Info","lastUpdated":"1/29/2023","lastUpdatedAt":"2023-01-29T01:31:56.000Z","gitCreatedAt":"2023-01-29T01:31:56.000Z"}},{"frontmatter":{"title":"","draft":false},"fields":{"slug":"/WebizenTechStack/EngineeringConsiderations/InternetStrategy/ListOfProtocolsISOmodel/","title":"List of Protocols ISO model","lastUpdated":"1/29/2023","lastUpdatedAt":"2023-01-29T01:31:56.000Z","gitCreatedAt":"2023-01-29T01:31:56.000Z"}},{"frontmatter":{"title":"","draft":false},"fields":{"slug":"/WebizenTechStack/Webizen2.5/ChatGPTSupported/ChatGPTDistributedDBGoNotes/","title":"ChatGPTDistributedDBGoNotes","lastUpdated":"1/29/2023","lastUpdatedAt":"2023-01-29T01:31:56.000Z","gitCreatedAt":"2023-01-29T01:31:56.000Z"}},{"frontmatter":{"title":"","draft":false},"fields":{"slug":"/WebizenTechStack/Webizen2.5/ChatGPTSupported/GoLangWebIDOIDC/","title":"Go WebID-OIDC & ChatGPT","lastUpdated":"1/29/2023","lastUpdatedAt":"2023-01-29T01:31:56.000Z","gitCreatedAt":"2023-01-29T01:31:56.000Z"}},{"frontmatter":{"title":"","draft":false},"fields":{"slug":"/WebizenTechStack/Webizen2.5/DevNotesWebizen2.5/AgentAPI/","title":"AgentAPI","lastUpdated":"1/29/2023","lastUpdatedAt":"2023-01-29T01:31:56.000Z","gitCreatedAt":"2023-01-29T01:31:56.000Z"}},{"frontmatter":{"title":"","draft":false},"fields":{"slug":"/WebizenTechStack/Webizen2.5/DevNotesWebizen2.5/AppRequirements/","title":"AppRequirements","lastUpdated":"1/29/2023","lastUpdatedAt":"2023-01-29T01:31:56.000Z","gitCreatedAt":"2023-01-29T01:31:56.000Z"}},{"frontmatter":{"title":"","draft":false},"fields":{"slug":"/WebizenTechStack/Webizen2.5/DevNotesWebizen2.5/CryptographyNotes/","title":"Cryptography Notes","lastUpdated":"1/29/2023","lastUpdatedAt":"2023-01-29T01:31:56.000Z","gitCreatedAt":"2023-01-29T01:31:56.000Z"}},{"frontmatter":{"title":"","draft":false},"fields":{"slug":"/WebizenTechStack/Webizen2.5/DevNotesWebizen2.5/PCT-SocialAPI/","title":"PCT-SocialAPI","lastUpdated":"1/29/2023","lastUpdatedAt":"2023-01-29T01:31:56.000Z","gitCreatedAt":"2023-01-29T01:31:56.000Z"}},{"frontmatter":{"title":"","draft":false},"fields":{"slug":"/WebizenTechStack/Webizen2.5/DevNotesWebizen2.5/POCAppRequirements/","title":"Proof Of Concept App Reqs","lastUpdated":"1/29/2023","lastUpdatedAt":"2023-01-29T01:31:56.000Z","gitCreatedAt":"2023-01-29T01:31:56.000Z"}},{"frontmatter":{"title":"","draft":false},"fields":{"slug":"/WebizenTechStack/Webizen2.5/DevNotesWebizen2.5/WebizenEngine/","title":"WebizenEngine","lastUpdated":"1/29/2023","lastUpdatedAt":"2023-01-29T01:31:56.000Z","gitCreatedAt":"2023-01-29T01:31:56.000Z"}},{"frontmatter":{"title":"","draft":false},"fields":{"slug":"/WebizenTechStack/Webizen2.5/FunctionalObjectives/FUNCTIONS/","title":"FUNCTIONS","lastUpdated":"1/29/2023","lastUpdatedAt":"2023-01-29T01:31:56.000Z","gitCreatedAt":"2023-01-29T01:31:56.000Z"}},{"frontmatter":{"title":"","draft":false},"fields":{"slug":"/WebizenTechStack/Webizen2.5/FunctionalObjectives/HelperAppObjectives/","title":"HelperAppObjectives","lastUpdated":"1/29/2023","lastUpdatedAt":"2023-01-29T01:31:56.000Z","gitCreatedAt":"2023-01-29T01:31:56.000Z"}},{"frontmatter":{"title":"","draft":false},"fields":{"slug":"/WebizenTechStack/Webizen2.5/FunctionalObjectives/PCT-NOTES/","title":"PCT-NOTES","lastUpdated":"1/29/2023","lastUpdatedAt":"2023-01-29T01:31:56.000Z","gitCreatedAt":"2023-01-29T01:31:56.000Z"}},{"frontmatter":{"title":"","draft":false},"fields":{"slug":"/WebizenTechStack/Webizen2.5/FunctionalObjectives/RootConcepts/","title":"Webizen - Root Concepts","lastUpdated":"1/29/2023","lastUpdatedAt":"2023-01-29T01:31:56.000Z","gitCreatedAt":"2023-01-29T01:31:56.000Z"}},{"frontmatter":{"title":"","draft":false},"fields":{"slug":"/WebizenTechStack/Webizen3.0/HostServiceRequirements/DomainHosting/","title":"Domain Hosting","lastUpdated":"1/9/2023","lastUpdatedAt":"2023-01-09T04:33:42.000Z","gitCreatedAt":"2023-01-09T04:33:42.000Z"}},{"frontmatter":{"title":"","draft":false},"fields":{"slug":"/WebizenTechStack/Webizen3.0/HostServiceRequirements/MediaProcessing/","title":"Media Processing","lastUpdated":"1/9/2023","lastUpdatedAt":"2023-01-09T04:33:42.000Z","gitCreatedAt":"2023-01-09T04:33:42.000Z"}},{"frontmatter":{"title":"","draft":false},"fields":{"slug":"/WebizenTechStack/Webizen3.0/HostServiceRequirements/NetworkingConsiderations/","title":"Networking Considerations","lastUpdated":"1/9/2023","lastUpdatedAt":"2023-01-09T04:33:42.000Z","gitCreatedAt":"2023-01-09T04:33:42.000Z"}},{"frontmatter":{"title":"","draft":false},"fields":{"slug":"/WebizenTechStack/Webizen3.0/HyperMediaContainers/KnowledgeDocuments/","title":"Knowledge Documents","lastUpdated":"1/9/2023","lastUpdatedAt":"2023-01-09T04:33:42.000Z","gitCreatedAt":"2023-01-09T04:33:42.000Z"}},{"frontmatter":{"title":"","draft":false},"fields":{"slug":"/WebizenTechStack/Webizen3.0/HyperMediaContainers/webizen.n3/","title":"webizen.n3","lastUpdated":"1/18/2023","lastUpdatedAt":"2023-01-18T16:25:14.000Z","gitCreatedAt":"2023-01-09T04:33:42.000Z"}},{"frontmatter":{"title":"","draft":false},"fields":{"slug":"/WebizenTechStack/Webizen3.5/AICapabilities/AICapabilitiesObjectives/","title":"AI Capabilities Objectives","lastUpdated":"1/9/2023","lastUpdatedAt":"2023-01-09T04:33:42.000Z","gitCreatedAt":"2023-01-09T04:33:42.000Z"}},{"frontmatter":{"title":"","draft":false},"fields":{"slug":"/WebizenTechStack/Webizen3.5/WebizenProSeries/WebizenPro-Edge/","title":"Webizen Pro - Edge","lastUpdated":"1/9/2023","lastUpdatedAt":"2023-01-09T04:33:42.000Z","gitCreatedAt":"2023-01-09T04:33:42.000Z"}},{"frontmatter":{"title":"","draft":false},"fields":{"slug":"/WebizenTechStack/Webizen3.5/WebizenProSeries/WebizenPro/","title":"Webizen Pro","lastUpdated":"1/18/2023","lastUpdatedAt":"2023-01-18T10:51:50.000Z","gitCreatedAt":"2023-01-09T04:33:42.000Z"}},{"frontmatter":{"title":"","draft":false},"fields":{"slug":"/WebizenTechStack/Webizen3.5/WebizenProSeries/WebizenProHardware/","title":"WebizenProHardware","lastUpdated":"1/9/2023","lastUpdatedAt":"2023-01-09T04:33:42.000Z","gitCreatedAt":"2023-01-09T04:33:42.000Z"}},{"frontmatter":{"title":"","draft":false},"fields":{"slug":"/WebizenTechStack/Webizen3.5/WebizenProSeries/WebizenProSoftware/","title":"WebizenProSoftware","lastUpdated":"1/9/2023","lastUpdatedAt":"2023-01-09T04:33:42.000Z","gitCreatedAt":"2023-01-09T04:33:42.000Z"}},{"frontmatter":{"title":"","draft":false},"fields":{"slug":"/WebizenTechStack/WebizenApps/Webizen3.0Apps/CoreApps/","title":"Webizen Core Apps","lastUpdated":"1/9/2023","lastUpdatedAt":"2023-01-09T04:33:42.000Z","gitCreatedAt":"2023-01-09T04:33:42.000Z"}},{"frontmatter":{"title":"","draft":false},"fields":{"slug":"/WebizenTechStack/WebizenApps/Webizen3.0Apps/DesignGoals/","title":"Design Goals","lastUpdated":"1/9/2023","lastUpdatedAt":"2023-01-09T04:33:42.000Z","gitCreatedAt":"2023-01-09T04:33:42.000Z"}},{"frontmatter":{"title":"","draft":false},"fields":{"slug":"/WebizenTechStack/WebizenApps/Webizen3.0Apps/MobileBasics/","title":"MobileBasics","lastUpdated":"1/15/2023","lastUpdatedAt":"2023-01-15T11:50:09.000Z","gitCreatedAt":"2023-01-14T07:33:42.000Z"}},{"frontmatter":{"title":"","draft":false},"fields":{"slug":"/WebizenTechStack/WebizenApps/Webizen3.0Apps/NoCodeAppDev/","title":"WADE No-Code - Low-Code","lastUpdated":"1/15/2023","lastUpdatedAt":"2023-01-15T11:50:09.000Z","gitCreatedAt":"2023-01-15T11:50:09.000Z"}},{"frontmatter":{"title":"","draft":false},"fields":{"slug":"/WebizenTechStack/WebizenApps/Webizen3.0Apps/Webizen-Connect/","title":"Webizen-Connect","lastUpdated":"1/9/2023","lastUpdatedAt":"2023-01-09T04:33:42.000Z","gitCreatedAt":"2023-01-09T04:33:42.000Z"}},{"frontmatter":{"title":"","draft":false},"fields":{"slug":"/WebizenTechStack/WebizenApps/Webizen3.0Apps/WebizenAppSpec/","title":"Webizen App Spec","lastUpdated":"1/9/2023","lastUpdatedAt":"2023-01-09T05:17:16.000Z","gitCreatedAt":"2023-01-09T04:33:42.000Z"}},{"frontmatter":{"title":"","draft":false},"fields":{"slug":"/WebizenTechStack/WebizenApps/Webizen3.5Apps/HostApps/","title":"Webizen Host Apps","lastUpdated":"1/9/2023","lastUpdatedAt":"2023-01-09T04:33:42.000Z","gitCreatedAt":"2023-01-09T04:33:42.000Z"}},{"frontmatter":{"title":"","draft":false},"fields":{"slug":"/WebizenTechStack/WebizenApps/Webizen3.5Apps/MediaProduction/","title":"Media Production","lastUpdated":"1/9/2023","lastUpdatedAt":"2023-01-09T04:33:42.000Z","gitCreatedAt":"2023-01-09T04:33:42.000Z"}},{"frontmatter":{"title":"","draft":false},"fields":{"slug":"/WebizenTechStack/WebizenApps/Webizen3.5Apps/MobileApps/","title":"Mobile Apps","lastUpdated":"1/9/2023","lastUpdatedAt":"2023-01-09T04:33:42.000Z","gitCreatedAt":"2023-01-09T04:33:42.000Z"}},{"frontmatter":{"title":"","draft":false},"fields":{"slug":"/WebizenTechStack/WebizenApps/Webizen3.5Apps/Search/","title":"Search","lastUpdated":"1/9/2023","lastUpdatedAt":"2023-01-09T04:33:42.000Z","gitCreatedAt":"2023-01-09T04:33:42.000Z"}},{"frontmatter":{"title":"","draft":false},"fields":{"slug":"/WebizenTechStack/WebizenApps/Webizen3.5Apps/WebizenManager/","title":"Webizen Manager","lastUpdated":"1/9/2023","lastUpdatedAt":"2023-01-09T04:33:42.000Z","gitCreatedAt":"2023-01-09T04:33:42.000Z"}},{"frontmatter":{"title":"","draft":false},"fields":{"slug":"/WebizenTechStack/WebizenApps/WebizenInterfaces/API/","title":"API","lastUpdated":"2/4/2023","lastUpdatedAt":"2023-02-04T16:41:41.000Z","gitCreatedAt":"2023-02-04T16:41:41.000Z"}},{"frontmatter":{"title":"","draft":false},"fields":{"slug":"/WebizenTechStack/WebizenApps/WebizenInterfaces/TheAttendant/","title":"The Attendant","lastUpdated":"2/4/2023","lastUpdatedAt":"2023-02-04T16:41:41.000Z","gitCreatedAt":"2023-02-04T16:41:41.000Z"}},{"frontmatter":{"title":"","draft":false},"fields":{"slug":"/WebizenTechStack/WebizenApps/WebizenInterfaces/TheWebizen/","title":"TheWebizen","lastUpdated":"1/15/2023","lastUpdatedAt":"2023-01-15T11:50:09.000Z","gitCreatedAt":"2023-01-15T11:50:09.000Z"}},{"frontmatter":{"title":"Link Library","draft":false},"fields":{"slug":"/old-work-archives/2018-webizen-net-au/_link_library_links/2018-09-23-wp-linked-data/","title":"Link Library","lastUpdated":"12/30/2022","lastUpdatedAt":"2022-12-30T11:53:44.000Z","gitCreatedAt":"2022-12-28T17:50:45.000Z"}},{"frontmatter":{"title":"About The Author","draft":false},"fields":{"slug":"/old-work-archives/2018-webizen-net-au/about/about-the-author/","title":"About The Author","lastUpdated":"1/18/2023","lastUpdatedAt":"2023-01-18T10:51:50.000Z","gitCreatedAt":"2022-12-28T17:37:56.000Z"}},{"frontmatter":{"title":"Applied Theory: Applications for a Human Centric Web","draft":false},"fields":{"slug":"/old-work-archives/2018-webizen-net-au/about/applied-theory-applications-for-a-human-centric-web/","title":"Applied Theory: Applications for a Human Centric Web","lastUpdated":"12/30/2022","lastUpdatedAt":"2022-12-30T11:53:44.000Z","gitCreatedAt":"2022-12-28T17:37:56.000Z"}},{"frontmatter":{"title":"Executive Summary","draft":false},"fields":{"slug":"/old-work-archives/2018-webizen-net-au/about/executive-summary/","title":"Executive Summary","lastUpdated":"12/30/2022","lastUpdatedAt":"2022-12-30T11:53:44.000Z","gitCreatedAt":"2022-12-28T17:37:56.000Z"}},{"frontmatter":{"title":"Knowledge Banking: A Technical Architecture Summary","draft":false},"fields":{"slug":"/old-work-archives/2018-webizen-net-au/about/knowledge-banking-a-technical-architecture-summary/","title":"Knowledge Banking: A Technical Architecture Summary","lastUpdated":"12/30/2022","lastUpdatedAt":"2022-12-30T11:53:44.000Z","gitCreatedAt":"2022-12-28T17:37:56.000Z"}},{"frontmatter":{"title":"References","draft":false},"fields":{"slug":"/old-work-archives/2018-webizen-net-au/about/references/","title":"References","lastUpdated":"12/30/2022","lastUpdatedAt":"2022-12-30T11:53:44.000Z","gitCreatedAt":"2022-12-28T17:37:56.000Z"}},{"frontmatter":{"title":"The design of new medium","draft":false},"fields":{"slug":"/old-work-archives/2018-webizen-net-au/about/the-design-of-new-medium/","title":"The design of new medium","lastUpdated":"12/30/2022","lastUpdatedAt":"2022-12-30T11:53:44.000Z","gitCreatedAt":"2022-12-28T17:37:56.000Z"}},{"frontmatter":{"title":"The need to modernise socioeconomic infrastructure","draft":false},"fields":{"slug":"/old-work-archives/2018-webizen-net-au/about/the-modernisation-of-socioeconomics/","title":"The need to modernise socioeconomic infrastructure","lastUpdated":"12/30/2022","lastUpdatedAt":"2022-12-30T11:53:44.000Z","gitCreatedAt":"2022-12-28T17:37:56.000Z"}},{"frontmatter":{"title":"The Vision","draft":false},"fields":{"slug":"/old-work-archives/2018-webizen-net-au/about/the-vision/","title":"The Vision","lastUpdated":"12/30/2022","lastUpdatedAt":"2022-12-30T11:53:44.000Z","gitCreatedAt":"2022-12-28T17:37:56.000Z"}},{"frontmatter":{"title":"","draft":false},"fields":{"slug":"/old-work-archives/2018-webizen-net-au/posts/About W3C/","title":"About W3C","lastUpdated":"12/30/2022","lastUpdatedAt":"2022-12-30T19:33:05.000Z","gitCreatedAt":"2022-12-30T19:33:05.000Z"}},{"frontmatter":{"title":"","draft":false},"fields":{"slug":"/old-work-archives/2018-webizen-net-au/posts/Advanced Functions & Facebook Pages/","title":"Advanced Functions & Facebook Pages","lastUpdated":"12/30/2022","lastUpdatedAt":"2022-12-30T19:33:05.000Z","gitCreatedAt":"2022-12-30T19:33:05.000Z"}},{"frontmatter":{"title":"","draft":false},"fields":{"slug":"/old-work-archives/2018-webizen-net-au/posts/Advanced Search & Discovery Tips/","title":"Advanced Search & Discovery Tips","lastUpdated":"12/30/2022","lastUpdatedAt":"2022-12-30T19:33:05.000Z","gitCreatedAt":"2022-12-30T19:33:05.000Z"}},{"frontmatter":{"title":"","draft":false},"fields":{"slug":"/old-work-archives/2018-webizen-net-au/posts/An introduction to Virtual Machines/","title":"An Introduction to Virtual Machines","lastUpdated":"12/30/2022","lastUpdatedAt":"2022-12-30T19:33:05.000Z","gitCreatedAt":"2022-12-30T19:33:05.000Z"}},{"frontmatter":{"title":"","draft":false},"fields":{"slug":"/old-work-archives/2018-webizen-net-au/posts/Basic Media Analysis & Part 1 (Audio)/","title":"Basic Media Analysis & Part 1 (Audio)","lastUpdated":"12/30/2022","lastUpdatedAt":"2022-12-30T19:33:05.000Z","gitCreatedAt":"2022-12-30T19:33:05.000Z"}},{"frontmatter":{"title":"","draft":false},"fields":{"slug":"/old-work-archives/2018-webizen-net-au/posts/Basic Media Analysis & Part 2 (visual)/","title":"Basic Media Analysis & Part 2 (Visual)","lastUpdated":"12/30/2022","lastUpdatedAt":"2022-12-30T19:33:05.000Z","gitCreatedAt":"2022-12-30T19:33:05.000Z"}},{"frontmatter":{"title":"","draft":false},"fields":{"slug":"/old-work-archives/2018-webizen-net-au/posts/Basic Media Analysis & Part 3 (Text & Metadata)/","title":"Basic Media Analysis & Part 3 (Text & Metadata)","lastUpdated":"12/30/2022","lastUpdatedAt":"2022-12-30T19:33:05.000Z","gitCreatedAt":"2022-12-30T19:33:05.000Z"}},{"frontmatter":{"title":"","draft":false},"fields":{"slug":"/old-work-archives/2018-webizen-net-au/posts/Building an Economy based upon Knowledge Equity/","title":"Building an Economy Based upon Knowledge Equity","lastUpdated":"12/30/2022","lastUpdatedAt":"2022-12-30T19:33:05.000Z","gitCreatedAt":"2022-12-30T19:33:05.000Z"}},{"frontmatter":{"title":"","draft":false},"fields":{"slug":"/old-work-archives/2018-webizen-net-au/posts/Choice of Law/","title":"Choice of Law","lastUpdated":"12/30/2022","lastUpdatedAt":"2022-12-30T19:33:05.000Z","gitCreatedAt":"2022-12-30T19:33:05.000Z"}},{"frontmatter":{"title":"","draft":false},"fields":{"slug":"/old-work-archives/2018-webizen-net-au/posts/Contemplation of the ITU Dubai Meeting and the Future of the Internet/","title":"Contemplation of the ITU Dubai Meeting and the Future of the Internet","lastUpdated":"12/30/2022","lastUpdatedAt":"2022-12-30T19:33:05.000Z","gitCreatedAt":"2022-12-30T19:33:05.000Z"}},{"frontmatter":{"title":"","draft":false},"fields":{"slug":"/old-work-archives/2018-webizen-net-au/posts/Creating a Presence & Online/","title":"Creating a Presence & Online","lastUpdated":"12/30/2022","lastUpdatedAt":"2022-12-30T19:33:05.000Z","gitCreatedAt":"2022-12-30T19:33:05.000Z"}},{"frontmatter":{"title":"","draft":false},"fields":{"slug":"/old-work-archives/2018-webizen-net-au/posts/Credentials and Payments by Manu Sporny/","title":"Credentials and Payments by Manu Sporny","lastUpdated":"12/30/2022","lastUpdatedAt":"2022-12-30T19:33:05.000Z","gitCreatedAt":"2022-12-30T19:33:05.000Z"}},{"frontmatter":{"title":"","draft":false},"fields":{"slug":"/old-work-archives/2018-webizen-net-au/posts/Data Recovery & Collection Mobile Devices/","title":"Data Recovery & Collection Mobile Devices","lastUpdated":"12/30/2022","lastUpdatedAt":"2022-12-30T19:33:05.000Z","gitCreatedAt":"2022-12-30T19:33:05.000Z"}},{"frontmatter":{"title":"","draft":false},"fields":{"slug":"/old-work-archives/2018-webizen-net-au/posts/Data Recovery - Laptop & Computers/","title":"Data Recovery - Laptop & Computers","lastUpdated":"12/30/2022","lastUpdatedAt":"2022-12-30T19:33:05.000Z","gitCreatedAt":"2022-12-30T19:33:05.000Z"}},{"frontmatter":{"title":"","draft":false},"fields":{"slug":"/old-work-archives/2018-webizen-net-au/posts/Decentralized Web Conference 2016/","title":"Decentralized Web Conference 2016","lastUpdated":"12/30/2022","lastUpdatedAt":"2022-12-30T19:33:05.000Z","gitCreatedAt":"2022-12-30T19:33:05.000Z"}},{"frontmatter":{"title":"","draft":false},"fields":{"slug":"/old-work-archives/2018-webizen-net-au/posts/Decentralized Web Summit 2018/","title":"Decentralized Web Summit 2018","lastUpdated":"12/30/2022","lastUpdatedAt":"2022-12-30T19:33:05.000Z","gitCreatedAt":"2022-12-30T19:33:05.000Z"}},{"frontmatter":{"title":"","draft":false},"fields":{"slug":"/old-work-archives/2018-webizen-net-au/posts/Does Anonymity exist/","title":"Does Anonymity Exist","lastUpdated":"12/30/2022","lastUpdatedAt":"2022-12-30T19:33:05.000Z","gitCreatedAt":"2022-12-30T19:33:05.000Z"}},{"frontmatter":{"title":"","draft":false},"fields":{"slug":"/old-work-archives/2018-webizen-net-au/posts/Downloading My Data from Social Networks/","title":"Downloading My Data From Social Networks","lastUpdated":"12/30/2022","lastUpdatedAt":"2022-12-30T19:33:05.000Z","gitCreatedAt":"2022-12-30T19:33:05.000Z"}},{"frontmatter":{"title":"","draft":false},"fields":{"slug":"/old-work-archives/2018-webizen-net-au/posts/Facebook Pages/","title":"Facebook Pages","lastUpdated":"12/30/2022","lastUpdatedAt":"2022-12-30T19:33:05.000Z","gitCreatedAt":"2022-12-30T19:33:05.000Z"}},{"frontmatter":{"title":"","draft":false},"fields":{"slug":"/old-work-archives/2018-webizen-net-au/posts/Google Tracking Data (geolocation)/","title":"Google Tracking Data (Geolocation)","lastUpdated":"12/30/2022","lastUpdatedAt":"2022-12-30T19:33:05.000Z","gitCreatedAt":"2022-12-30T19:33:05.000Z"}},{"frontmatter":{"title":"","draft":false},"fields":{"slug":"/old-work-archives/2018-webizen-net-au/posts/Human Consciousness/","title":"Human Consciousness","lastUpdated":"12/30/2022","lastUpdatedAt":"2022-12-30T19:33:05.000Z","gitCreatedAt":"2022-12-30T19:33:05.000Z"}},{"frontmatter":{"title":"","draft":false},"fields":{"slug":"/old-work-archives/2018-webizen-net-au/posts/Image Recgonition Video Playlist/","title":"Image Recgonition Video Playlist","lastUpdated":"12/30/2022","lastUpdatedAt":"2022-12-30T19:33:05.000Z","gitCreatedAt":"2022-12-30T19:33:05.000Z"}},{"frontmatter":{"title":"","draft":false},"fields":{"slug":"/old-work-archives/2018-webizen-net-au/posts/Inferencing (introduction)/","title":"Inferencing (Introduction)","lastUpdated":"12/30/2022","lastUpdatedAt":"2022-12-30T19:33:05.000Z","gitCreatedAt":"2022-12-30T19:33:05.000Z"}},{"frontmatter":{"title":"","draft":false},"fields":{"slug":"/PermissiveCommons/PermissiveCommonsTech/PCTWorkInProgress/PermissiveCommonsRequirements/","title":"Permissive Commons Technology (PCT) Requirements.","lastUpdated":"1/20/2023","lastUpdatedAt":"2023-01-20T22:14:02.000Z","gitCreatedAt":"2023-01-19T10:09:31.000Z"}},{"frontmatter":{"title":"","draft":false},"fields":{"slug":"/PermissiveCommons/PermissiveCommonsTech/PCTWorkInProgress/MinimumWages/","title":"Minimum Wages","lastUpdated":"1/19/2023","lastUpdatedAt":"2023-01-19T10:09:31.000Z","gitCreatedAt":"2023-01-19T10:09:31.000Z"}},{"frontmatter":{"title":"","draft":false},"fields":{"slug":"/PermissiveCommons/PermissiveCommonsTech/PCTWorkInProgress/KnowledgeModelling/","title":"Knowledge Modelling","lastUpdated":"1/20/2023","lastUpdatedAt":"2023-01-20T22:14:02.000Z","gitCreatedAt":"2023-01-20T22:14:02.000Z"}},{"frontmatter":{"title":"","draft":false},"fields":{"slug":"/old-work-archives/2018-webizen-net-au/posts/Introduction to AI/","title":"Introduction to AI","lastUpdated":"12/30/2022","lastUpdatedAt":"2022-12-30T19:33:05.000Z","gitCreatedAt":"2022-12-30T19:33:05.000Z"}},{"frontmatter":{"title":"","draft":false},"fields":{"slug":"/old-work-archives/2018-webizen-net-au/posts/Introduction to Linked Data/","title":"What is <span class=\"textannotation disambiguated wl-thing\" id=\"urn:local-text-annotation-16v2koc9fcuj5lwn7helj9zpo9t4iqv4\" itemid=\"http://data.wordlift.io/wl0293/entity/linked_data\">Linked Data</span>?","lastUpdated":"12/30/2022","lastUpdatedAt":"2022-12-30T19:33:05.000Z","gitCreatedAt":"2022-12-30T19:33:05.000Z"}},{"frontmatter":{"title":"","draft":false},"fields":{"slug":"/old-work-archives/2018-webizen-net-au/posts/Introduction to Maltego/","title":"Introduction to Maltego","lastUpdated":"12/30/2022","lastUpdatedAt":"2022-12-30T19:33:05.000Z","gitCreatedAt":"2022-12-30T19:33:05.000Z"}},{"frontmatter":{"title":"","draft":false},"fields":{"slug":"/old-work-archives/2018-webizen-net-au/posts/Introduction to Ontologies/","title":"Introduction to Ontologies","lastUpdated":"12/30/2022","lastUpdatedAt":"2022-12-30T19:33:05.000Z","gitCreatedAt":"2022-12-30T19:33:05.000Z"}},{"frontmatter":{"title":"","draft":false},"fields":{"slug":"/old-work-archives/2018-webizen-net-au/posts/Introduction to Semantic Web/","title":"Introduction to Semantic Web","lastUpdated":"12/30/2022","lastUpdatedAt":"2022-12-30T19:33:05.000Z","gitCreatedAt":"2022-12-30T19:33:05.000Z"}},{"frontmatter":{"title":"","draft":false},"fields":{"slug":"/old-work-archives/2018-webizen-net-au/posts/MindMapping & Setting-up a business & Identity/","title":"MindMapping & Setting-up a Business & Identity","lastUpdated":"12/30/2022","lastUpdatedAt":"2022-12-30T19:33:05.000Z","gitCreatedAt":"2022-12-30T19:33:05.000Z"}},{"frontmatter":{"title":"","draft":false},"fields":{"slug":"/old-work-archives/2018-webizen-net-au/posts/OpenRefine/","title":"OpenRefine","lastUpdated":"12/30/2022","lastUpdatedAt":"2022-12-30T19:33:05.000Z","gitCreatedAt":"2022-12-30T19:33:05.000Z"}},{"frontmatter":{"title":"","draft":false},"fields":{"slug":"/old-work-archives/2018-webizen-net-au/posts/Openlink Virtuoso/","title":"Openlink Virtuoso","lastUpdated":"12/30/2022","lastUpdatedAt":"2022-12-30T19:33:05.000Z","gitCreatedAt":"2022-12-30T19:33:05.000Z"}},{"frontmatter":{"title":"","draft":false},"fields":{"slug":"/old-work-archives/2018-webizen-net-au/posts/RWW & some Solid history/","title":"RWW & some Solid History","lastUpdated":"12/30/2022","lastUpdatedAt":"2022-12-30T19:33:05.000Z","gitCreatedAt":"2022-12-30T19:33:05.000Z"}},{"frontmatter":{"title":"","draft":false},"fields":{"slug":"/old-work-archives/2018-webizen-net-au/posts/Semantic Web (An Intro)/","title":"Semantic Web (An Intro)","lastUpdated":"12/30/2022","lastUpdatedAt":"2022-12-30T19:33:05.000Z","gitCreatedAt":"2022-12-30T19:33:05.000Z"}},{"frontmatter":{"title":"","draft":false},"fields":{"slug":"/old-work-archives/2018-webizen-net-au/posts/Setting-up Twitter/","title":"Setting-up Twitter","lastUpdated":"12/30/2022","lastUpdatedAt":"2022-12-30T19:33:05.000Z","gitCreatedAt":"2022-12-30T19:33:05.000Z"}},{"frontmatter":{"title":"","draft":false},"fields":{"slug":"/old-work-archives/2018-webizen-net-au/posts/Social Encryption An Introduction/","title":"Social Encryption An Introduction","lastUpdated":"12/30/2022","lastUpdatedAt":"2022-12-30T19:33:05.000Z","gitCreatedAt":"2022-12-30T19:33:05.000Z"}},{"frontmatter":{"title":"","draft":false},"fields":{"slug":"/old-work-archives/2018-webizen-net-au/posts/Stock Content/","title":"Stock Content","lastUpdated":"12/30/2022","lastUpdatedAt":"2022-12-30T19:33:05.000Z","gitCreatedAt":"2022-12-30T19:33:05.000Z"}},{"frontmatter":{"title":"","draft":false},"fields":{"slug":"/old-work-archives/2018-webizen-net-au/posts/The WayBack Machine/","title":"The WayBack Machine","lastUpdated":"12/30/2022","lastUpdatedAt":"2022-12-30T19:33:05.000Z","gitCreatedAt":"2022-12-30T19:33:05.000Z"}},{"frontmatter":{"title":"","draft":false},"fields":{"slug":"/old-work-archives/2018-webizen-net-au/posts/Tim Berners Lee & Turing Lecture/","title":"Tim Berners Lee & Turing Lecture","lastUpdated":"12/30/2022","lastUpdatedAt":"2022-12-30T19:33:05.000Z","gitCreatedAt":"2022-12-30T19:33:05.000Z"}},{"frontmatter":{"title":"","draft":false},"fields":{"slug":"/old-work-archives/2018-webizen-net-au/posts/Trust Factory 2017/","title":"Trust Factory 2017","lastUpdated":"12/30/2022","lastUpdatedAt":"2022-12-30T19:33:05.000Z","gitCreatedAt":"2022-12-30T19:33:05.000Z"}},{"frontmatter":{"title":"","draft":false},"fields":{"slug":"/old-work-archives/2018-webizen-net-au/posts/Verifiable Claims (An Introduction)/","title":"Verifiable Claims (An Introduction)","lastUpdated":"12/30/2022","lastUpdatedAt":"2022-12-30T19:33:05.000Z","gitCreatedAt":"2022-12-30T19:33:05.000Z"}},{"frontmatter":{"title":"","draft":false},"fields":{"slug":"/old-work-archives/2018-webizen-net-au/posts/Web of Things & an Introduction/","title":"Web of Things & an Introduction","lastUpdated":"12/30/2022","lastUpdatedAt":"2022-12-30T19:33:05.000Z","gitCreatedAt":"2022-12-30T19:33:05.000Z"}},{"frontmatter":{"title":"","draft":false},"fields":{"slug":"/old-work-archives/2018-webizen-net-au/posts/Web-Persistence/","title":"Web-Persistence","lastUpdated":"12/30/2022","lastUpdatedAt":"2022-12-30T19:33:05.000Z","gitCreatedAt":"2022-12-30T19:33:05.000Z"}},{"frontmatter":{"title":"","draft":false},"fields":{"slug":"/old-work-archives/2018-webizen-net-au/posts/Web-Services & Marketing Tools/","title":"Web-Services & Marketing Tools","lastUpdated":"12/30/2022","lastUpdatedAt":"2022-12-30T19:33:05.000Z","gitCreatedAt":"2022-12-30T19:33:05.000Z"}},{"frontmatter":{"title":"","draft":false},"fields":{"slug":"/old-work-archives/2018-webizen-net-au/posts/Website Templates/","title":"Website Templates","lastUpdated":"12/30/2022","lastUpdatedAt":"2022-12-30T19:33:05.000Z","gitCreatedAt":"2022-12-30T19:33:05.000Z"}},{"frontmatter":{"title":"","draft":false},"fields":{"slug":"/old-work-archives/2018-webizen-net-au/posts/What is Linked Data/","title":"What Is Linked Data","lastUpdated":"12/30/2022","lastUpdatedAt":"2022-12-30T19:33:05.000Z","gitCreatedAt":"2022-12-30T19:33:05.000Z"}},{"frontmatter":{"title":"","draft":false},"fields":{"slug":"/old-work-archives/2018-webizen-net-au/posts/What is Open Source Intelligence/","title":"What Is Open Source Intelligence","lastUpdated":"12/30/2022","lastUpdatedAt":"2022-12-30T19:33:05.000Z","gitCreatedAt":"2022-12-30T19:33:05.000Z"}},{"frontmatter":{"title":"","draft":false},"fields":{"slug":"/old-work-archives/2018-webizen-net-au/posts/knowledge-capital/","title":"Knowledge-Capital","lastUpdated":"12/30/2022","lastUpdatedAt":"2022-12-30T19:33:05.000Z","gitCreatedAt":"2022-12-30T19:33:05.000Z"}},{"frontmatter":{"title":"","draft":false},"fields":{"slug":"/old-work-archives/2018-webizen-net-au/posts/logos-style-guides-and-artwork/","title":"Logos-Style-Guides-and-Artwork","lastUpdated":"12/30/2022","lastUpdatedAt":"2022-12-30T19:33:05.000Z","gitCreatedAt":"2022-12-30T19:33:05.000Z"}},{"frontmatter":{"title":"","draft":false},"fields":{"slug":"/old-work-archives/2018-webizen-net-au/posts/projects-customers-and-invoicing-web-services-for-startups/","title":"Projects-Customers-and-Invoicing-Web-Services-for-Startups","lastUpdated":"12/30/2022","lastUpdatedAt":"2022-12-30T19:33:05.000Z","gitCreatedAt":"2022-12-30T19:33:05.000Z"}},{"frontmatter":{"title":"","draft":false},"fields":{"slug":"/old-work-archives/2018-webizen-net-au/posts/tools-of-trade/","title":"Tools-of-Trade","lastUpdated":"12/30/2022","lastUpdatedAt":"2022-12-30T19:33:05.000Z","gitCreatedAt":"2022-12-30T19:33:05.000Z"}},{"frontmatter":{"title":"","draft":false},"fields":{"slug":"/old-work-archives/WebCivicsMediumPosts/2019/AnOpenLetter-WhatisyourDigitalIdentity MandateforHumanity/","title":"An Open Letter - What is your Digital Identity Mandate for Humanity","lastUpdated":"1/18/2023","lastUpdatedAt":"2023-01-18T10:51:50.000Z","gitCreatedAt":"2023-01-18T10:51:50.000Z"}},{"frontmatter":{"title":"","draft":false},"fields":{"slug":"/old-work-archives/WebCivicsMediumPosts/2019/Building a safe environment for Kids to thrive with their Digital Twin/","title":"Building a Safe Environment for Kids to Thrive with Their Digital Twin","lastUpdated":"1/18/2023","lastUpdatedAt":"2023-01-18T10:51:50.000Z","gitCreatedAt":"2023-01-18T10:51:50.000Z"}},{"frontmatter":{"title":"","draft":false},"fields":{"slug":"/old-work-archives/WebCivicsMediumPosts/2019/BuildingaNewStartfortheAustralianCreative Sector./","title":"Building a #NewStart for the Australian CreativeSector.","lastUpdated":"1/18/2023","lastUpdatedAt":"2023-01-18T10:51:50.000Z","gitCreatedAt":"2023-01-18T10:51:50.000Z"}},{"frontmatter":{"title":"","draft":false},"fields":{"slug":"/old-work-archives/WebCivicsMediumPosts/2019/CausalRelationshipsbetweenSocial informaticsdesignandQuantumMechanical Phenomenon./","title":"Causal Relationships between Social informatics design and Quantum Mechanical Phenomenon.","lastUpdated":"1/18/2023","lastUpdatedAt":"2023-01-18T10:51:50.000Z","gitCreatedAt":"2023-01-18T10:51:50.000Z"}},{"frontmatter":{"title":"","draft":false},"fields":{"slug":"/old-work-archives/WebCivicsMediumPosts/2019/Comms&SecurityPrivacyVsDignity/","title":"Comms & Security Privacy vs. Dignity","lastUpdated":"1/18/2023","lastUpdatedAt":"2023-01-18T10:51:50.000Z","gitCreatedAt":"2023-01-18T10:51:50.000Z"}},{"frontmatter":{"title":"","draft":false},"fields":{"slug":"/old-work-archives/WebCivicsMediumPosts/2019/EngineeringEinstein/","title":"Engineering Einstein","lastUpdated":"1/18/2023","lastUpdatedAt":"2023-01-18T10:51:50.000Z","gitCreatedAt":"2023-01-18T10:51:50.000Z"}},{"frontmatter":{"title":"","draft":false},"fields":{"slug":"/old-work-archives/WebCivicsMediumPosts/2019/HealthInformaticsHistoryChallenges& Opportunities/","title":"Health Informatics History, Challenges & Opportunities","lastUpdated":"1/18/2023","lastUpdatedAt":"2023-01-18T10:51:50.000Z","gitCreatedAt":"2023-01-18T10:51:50.000Z"}},{"frontmatter":{"title":"","draft":false},"fields":{"slug":"/old-work-archives/WebCivicsMediumPosts/2019/History of Banking, Knowledge Economy and Moral Poverty/","title":"History of Banking, Knowledge Economy and Moral Poverty","lastUpdated":"1/18/2023","lastUpdatedAt":"2023-01-18T10:51:50.000Z","gitCreatedAt":"2023-01-18T10:51:50.000Z"}},{"frontmatter":{"title":"","draft":false},"fields":{"slug":"/old-work-archives/WebCivicsMediumPosts/2019/HistoryCommunityCivics&GLAMMeanstoBootstrapDigitalEconomyGrowth&KnowledgeBankingTools./","title":"History Community, Civics & GLAM. Means to Bootstrap Digital Economy Growth & Knowledge Banking Tools.","lastUpdated":"1/18/2023","lastUpdatedAt":"2023-01-18T10:51:50.000Z","gitCreatedAt":"2023-01-18T10:51:50.000Z"}},{"frontmatter":{"title":"","draft":false},"fields":{"slug":"/old-work-archives/WebCivicsMediumPosts/2019/HyperMediaExhibition&EventsSpaces/","title":"HyperMedia Exhibition & Events Spaces","lastUpdated":"1/18/2023","lastUpdatedAt":"2023-01-18T10:51:50.000Z","gitCreatedAt":"2023-01-18T10:51:50.000Z"}},{"frontmatter":{"title":"","draft":false},"fields":{"slug":"/old-work-archives/WebCivicsMediumPosts/2019/Inforgs&TheCollectiveInfosphere/","title":"Inforgs & The Collective Infosphere","lastUpdated":"1/18/2023","lastUpdatedAt":"2023-01-18T10:51:50.000Z","gitCreatedAt":"2023-01-18T10:51:50.000Z"}},{"frontmatter":{"title":"","draft":false},"fields":{"slug":"/old-work-archives/WebCivicsMediumPosts/2019/Knowledge Banking Infrastructure - Cyber Socio-Economic Foundations for our shared world/","title":"Knowledge Banking Infrastructure - Cyber Socio-Economic Foundations for Our Shared World","lastUpdated":"1/18/2023","lastUpdatedAt":"2023-01-18T10:51:50.000Z","gitCreatedAt":"2023-01-18T10:51:50.000Z"}},{"frontmatter":{"title":"","draft":false},"fields":{"slug":"/old-work-archives/Web